iteration	timestamp	model	review_model	run_id	decision	val_bpb	val_loss	size_bytes	commit	idea	env	notes
60	2026-04-12T18:00:39+00:00	gpt-5.4	gpt-5.4	pgolf_0060	error				eadc92b90a71781b72f1d316f993149085eea54d	Add an opt-in audit-only measured train-shard coverage report that logs exact post-warmup shard consumption on the live sorted loader and replays the same consumed-token budget through deterministic sorted and seed-rotate shard orders for a self-check plus counterfactual coverage comparison.	TRAIN_SHARD_ORDER_AUDIT=1 TRAIN_SHARD_ORDER_AUDIT_LOG_TOPK=4	This is one bounded audit-only change in `train_gpt.py`. The live training stream, optimizer, model math, validation, and export path stay unchanged. The patch instruments `TokenStream` only when `TRAIN_SHARD_ORDER_AUDIT=1`, counts exact measured post-warmup stream tokens per shard plus wraps, and logs both the live summary and two metadata-only counterfactual replays (`sorted` and `seed_rotate`) using the exact measured token budget so pre-review can distinguish a real prefix-concentration signal from accounting noise. | stage=experiment | error=remote training failed for run_id=pgolf_0060 with exit code 255 | hypothesis=The previous round was right not to spend a live data-order ablation yet. First we need trustworthy evidence that the real 600-second measured run stays concentrated on a narrow lexicographic shard prefix after warmup reset. If the live loader only touches a small early prefix and the same measured token budget would touch materially different shards under a deterministic seed rotation, then shard start order is a causal training-exposure mechanism worth testing later. This should transfer better than serializer bookkeeping because it measures which training data the wallclock-limited run actually sees. | expected_signals=Support: the new `train_shard_usage` line reports exact `stream_tokens`, `optimizer_tokens`, `overlap_tokens`, `unique_shards`, `wraps`, and `lexicographic_prefix_share`, and the simulated `train_shard_order_audit mode:sorted` line matches that measured budget and coverage closely, validating the accounting. On top of that, `mode:seed_rotate` should keep the same `stream_tokens` but materially change `first_shards`/`top_shards` and reduce lexicographic-prefix share versus the live sorted path. Falsify: the measured `train_shard_usage` and simulated `mode:sorted` replay disagree materially, the live run already covers a broad shard set or low prefix share, or `mode:seed_rotate` yields nearly the same coverage summary as sorted under the same budget, which would mean shard-start work is not well supported. | pre_review_round=2
61	2026-04-12T18:04:42+00:00	gpt-5.4	gpt-5.4	pgolf_0061	error				791f95a9102a948cf373f9cbd07dced60faa81c5	Add an opt-in EMA export path that maintains an exponential moving average of model parameters during measured training and applies the EMA weights to the final exported checkpoint.	EMA_DECAY=0.995 INT8_KEEP_FLOAT_LARGE_NAME_PATTERNS=c_v.weight INT8_AUTO_KEEP_FLOAT_NAME_PATTERNS=tok_emb.weight,.attn.proj.weight,.mlp.proj.weight INT8_AUTO_KEEP_FLOAT_LOG_TOPK=5 INT8_FP32_SCALE_NAME_PATTERNS=.mlp.proj.weight INT8_MIN_CLIP_NAME_VALUE_OVERRIDES=.mlp.fc.weight:0.25 INT8_KEEP_FLOAT_FP32_EXTRA_NAME_PATTERNS=c_v.weight	This is one bounded training-side change in train_gpt.py. The patch adds EMA_DECAY validation, initializes the EMA state only after warmup restore so measured training starts from the true init, updates the EMA after each optimizer step, logs the configured decay, and copies the EMA weights into the model immediately before final serialization and exact round-trip evaluation. No tracked file other than train_gpt.py was edited, and training was not run locally. | stage=experiment | error=remote training failed for run_id=pgolf_0061 with exit code 255 | hypothesis=The current 600-second run is short and noisy enough that the last raw checkpoint is likely a worse submission point than a nearby temporal average. Maintaining a bounded EMA during measured training should smooth late-step optimizer noise and reduce weight outliers before the existing int8+zlib export, improving final_int8_zlib_roundtrip_exact val_bpb without changing model shape, data order, tokenizer, or the quantization format. This mechanism is plausible on the full challenge regime too because EMA is a standard training-side robustness tool rather than a proxy-only serializer tweak. | expected_signals=Support: the run logs ema_decay:0.995000 and ema_export:applied decay:0.995000 with an updates count close to the measured training step count; training throughput and measured step count stay in-family with the current export-only stack; submission size stays essentially unchanged; and final_int8_zlib_roundtrip_exact improves below the current best kept 1.58402850 val_bpb and 2.67456578 val_loss. Falsify: ema_export is missing, the EMA update count is inconsistent with measured steps, throughput changes materially despite the lightweight change, or final exact metrics stay flat or worsen versus the current best kept result, indicating the last-step checkpoint was already as good as or better than the temporal average. | pre_review_round=1
62	2026-04-12T18:10:05+00:00	gpt-5.4	gpt-5.4	pgolf_0062	error				0c1ea527bb4ca34d356e5448d51d922821336410	Add an opt-in decoupled weight decay term to Muon's matrix-parameter group and test a small nonzero MATRIX_WEIGHT_DECAY on top of the current pgolf_0042 export stack.	MATRIX_WEIGHT_DECAY=0.0005 INT8_KEEP_FLOAT_LARGE_NAME_PATTERNS=c_v.weight INT8_AUTO_KEEP_FLOAT_NAME_PATTERNS=tok_emb.weight,.attn.proj.weight,.mlp.proj.weight INT8_AUTO_KEEP_FLOAT_LOG_TOPK=5 INT8_FP32_SCALE_NAME_PATTERNS=.mlp.proj.weight INT8_MIN_CLIP_NAME_VALUE_OVERRIDES=.mlp.fc.weight:0.25 INT8_KEEP_FLOAT_FP32_EXTRA_NAME_PATTERNS=c_v.weight	This is one bounded training-side change in train_gpt.py. It adds MATRIX_WEIGHT_DECAY to Hyperparameters, validates and threads it through Muon, applies decoupled decay only on the Muon matrix-parameter update path immediately before the normalized update is applied, and logs the configured value. The Adam groups, model architecture, data loader, evaluation path, and serializer remain unchanged. | stage=experiment | error=remote training failed for run_id=pgolf_0062 with exit code 255 | hypothesis=The current best stack is still a short wallclock-limited trainer with no explicit shrinkage on the large transformer block matrices that dominate both parameter count and post-training int8 error. A small decoupled MATRIX_WEIGHT_DECAY applied only to Muon's matrix group should slightly suppress late-training weight growth and outliers in those matrices without changing model shape, data order, or the established export path. If that produces a smoother raw checkpoint with better-behaved large weights, the final int8 round-trip metric should improve. This mechanism is plausibly transferable to the full regime because it is a standard training-side regularization change rather than exporter bookkeeping. | expected_signals=Support: the run logs matrix_weight_decay:0.0005 in the optimizer summary, training throughput and measured step count stay in-family with the current export-only frontier, submission size stays essentially unchanged because the serializer path is unchanged, and final_int8_zlib_roundtrip_exact improves below the current best kept 1.58402850 val_bpb and 2.67456578 val_loss. Falsify: throughput or step count shifts materially despite this lightweight optimizer change, the run diverges or shows clearly worse train_loss behavior, or final exact round-trip metrics stay flat or worsen versus pgolf_0042, indicating that shrinking the Muon-managed matrices does not improve the exported checkpoint. | pre_review_round=1
63	2026-04-12T18:38:49+00:00	gpt-5.4	gpt-5.4	pgolf_0063	error				dd181e22952c62803bd2520914f3bd0039d9e3ab	Add an opt-in decoupled weight decay term to Muon's matrix-parameter group and test a small nonzero MATRIX_WEIGHT_DECAY on top of the kept pgolf_0042 export stack.	MATRIX_WEIGHT_DECAY=0.0005 INT8_KEEP_FLOAT_LARGE_NAME_PATTERNS=c_v.weight INT8_AUTO_KEEP_FLOAT_NAME_PATTERNS=tok_emb.weight,.attn.proj.weight,.mlp.proj.weight INT8_AUTO_KEEP_FLOAT_LOG_TOPK=5 INT8_FP32_SCALE_NAME_PATTERNS=.mlp.proj.weight INT8_MIN_CLIP_NAME_VALUE_OVERRIDES=.mlp.fc.weight:0.25 INT8_KEEP_FLOAT_FP32_EXTRA_NAME_PATTERNS=c_v.weight	This is one bounded training-side change in train_gpt.py. It adds MATRIX_WEIGHT_DECAY to Hyperparameters, validates and threads it through Muon, applies decoupled decay only on the Muon matrix-parameter update path immediately before the normalized update is applied, and logs the configured value. The Adam groups, model architecture, data loader, evaluation path, and serializer remain unchanged. This intentionally retries the previously unevaluated pgolf_0062 idea after its remote run failed with exit code 255 rather than a correctness finding. | stage=experiment | error=remote training failed for run_id=pgolf_0063 with exit code 255 | hypothesis=The current best stack is still a short wallclock-limited trainer with no explicit shrinkage on the large transformer block matrices that dominate both parameter count and post-training int8 error. A small decoupled MATRIX_WEIGHT_DECAY applied only to Muon's matrix group should slightly suppress late-training weight growth and outliers in those matrices without changing model shape, data order, or the established export path. If that produces a smoother raw checkpoint with better-behaved large weights, the final int8 round-trip metric should improve. This mechanism is plausibly transferable to the full regime because it is a standard training-side regularization change rather than exporter bookkeeping. | expected_signals=Support: the run logs matrix_weight_decay:0.0005 in the optimizer summary, training throughput and measured step count stay in-family with the current export-only frontier, submission size stays essentially unchanged because the serializer path is unchanged, and final_int8_zlib_roundtrip_exact improves below the current best kept 1.58402850 val_bpb and 2.67456578 val_loss. Falsify: throughput or step count shifts materially despite this lightweight optimizer change, the run diverges or shows clearly worse train_loss behavior, or final exact round-trip metrics stay flat or worsen versus pgolf_0042, indicating that shrinking the Muon-managed matrices does not improve the exported checkpoint. | pre_review_round=1
64	2026-04-12T18:44:42+00:00	gpt-5.4	gpt-5.4	pgolf_0064	error				320985f328ebcb15d21a247149b92921325742cc	Add a late-start EMA export path that initializes the EMA buffer only at the first eligible measured-training step, then exports the EMA weights through the kept pgolf_0042 serializer stack while preserving the raw final checkpoint separately.	EMA_DECAY=0.995 EMA_START_STEP=300 INT8_KEEP_FLOAT_LARGE_NAME_PATTERNS=c_v.weight INT8_AUTO_KEEP_FLOAT_NAME_PATTERNS=tok_emb.weight,.attn.proj.weight,.mlp.proj.weight INT8_AUTO_KEEP_FLOAT_LOG_TOPK=5 INT8_FP32_SCALE_NAME_PATTERNS=.mlp.proj.weight INT8_MIN_CLIP_NAME_VALUE_OVERRIDES=.mlp.fc.weight:0.25 INT8_KEEP_FLOAT_FP32_EXTRA_NAME_PATTERNS=c_v.weight	This is one bounded training-side change in `train_gpt.py`. It adds `EMA_DECAY` and `EMA_START_STEP`, validates them, keeps `ema_state=None` until the first eligible post-step update, clones the current model into the EMA buffer at that moment, applies decay only on subsequent eligible updates, logs whether EMA was actually applied, saves `final_model.pt` from the unmodified raw final weights, and drives int8 export/eval from a separate `export_state` so raw-versus-EMA semantics stay explicit. | stage=experiment | error=remote training failed for run_id=pgolf_0064 with exit code 255 | hypothesis=The current 600-second run is short and still optimization-limited, so the last raw checkpoint likely contains late-step noise that hurts both direct generalization and the final int8 round-trip export. A tail-only EMA should smooth only the unstable end of measured training without diluting the whole run with early checkpoints. Starting the EMA buffer exactly at EMA_START_STEP avoids mixing in any earlier mass, and preserving the raw final checkpoint separately keeps the experiment trustworthy. This mechanism is plausibly transferable to the full challenge regime because late-checkpoint averaging is a standard training-side robustness technique rather than exporter bookkeeping. | expected_signals=Support: the run logs `ema_decay:0.995000 ema_start_step:300`; later logs `ema_export:applied decay:0.995000 start_step:300` with `updates` close to the measured post-step count minus 299; the run keeps the established pgolf_0042 export-path signals pinned, including `Int8 auto-keep selector` with `candidates:19` and `selected:blocks.0.mlp.proj.weight`, `Int8 scale storage` with `fp32_tensors:8` and `fp32_bytes:16384`, `Int8 min-clip override` with `tensors:9 baseline:1.00000 overrides:.mlp.fc.weight:0.25000`, and `Kept float storage` with `extra_fp32_tensors:9` and `extra_fp32_extra_bytes:2359296`; training throughput and measured step count stay in-family with the current frontier; submission size stays essentially unchanged; and `final_int8_zlib_roundtrip_exact` improves below the current best kept 1.58402850 val_bpb and 2.67456578 val_loss. Falsify: `ema_export:applied` is missing despite reaching step 300, `updates` is inconsistent with the late-start rule, any pinned pgolf_0042 serializer signal drifts unexpectedly, throughput changes materially despite this lightweight addition, or final exact metrics stay flat or worsen versus pgolf_0042, indicating the raw last checkpoint is already at least as good as the late EMA average. | pre_review_round=3
65	2026-04-12T19:01:55+00:00	gpt-5.4	gpt-5.4	pgolf_0065	error				81b026fdfd5201e5742081a7c0d143205668afac	Add an opt-in decoupled weight decay term on the token embedding optimizer group and test a small nonzero EMBED_WEIGHT_DECAY on top of the kept pgolf_0042 export stack.	EMBED_WEIGHT_DECAY=0.002 INT8_KEEP_FLOAT_LARGE_NAME_PATTERNS=c_v.weight INT8_AUTO_KEEP_FLOAT_NAME_PATTERNS=tok_emb.weight,.attn.proj.weight,.mlp.proj.weight INT8_AUTO_KEEP_FLOAT_LOG_TOPK=5 INT8_FP32_SCALE_NAME_PATTERNS=.mlp.proj.weight INT8_MIN_CLIP_NAME_VALUE_OVERRIDES=.mlp.fc.weight:0.25 INT8_KEEP_FLOAT_FP32_EXTRA_NAME_PATTERNS=c_v.weight	This is one bounded training-side change in train_gpt.py. It adds EMBED_WEIGHT_DECAY to Hyperparameters, switches only the token embedding optimizer group to AdamW when that value is positive, keeps the default zero-decay path on the existing Adam implementation, threads the configured weight_decay only to the token embedding parameter group, and logs the configured value in the optimizer summary. The Muon matrix group, scalar/head optimizers, model architecture, data loader, evaluation path, and serializer remain unchanged. | stage=experiment | error=remote training failed for run_id=pgolf_0065 with exit code 255 | hypothesis=The current best pgolf_0042 stack still leaves the tied token embedding matrix fully trainable at a relatively large effective learning rate, and that matrix directly controls both input representations and output logits while also remaining one of the largest contributors to final int8 round-trip error. A small decoupled EMBED_WEIGHT_DECAY applied only to the token embedding optimizer group should modestly suppress late-training norm growth and outlier coefficients in that matrix without changing model shape, data order, or the established serializer path. If the raw checkpoint ends with a better-behaved embedding table, the final int8 round-trip metric should improve. This mechanism is plausibly transferable to the full challenge regime because it is ordinary training-side regularization on a dominant parameter family, not exporter bookkeeping. | expected_signals=Support: the run logs embed_weight_decay:0.002 in the optimizer summary; training throughput and measured step count stay in-family with the current frontier because the serializer path is unchanged; the established pgolf_0042 export-path signals remain pinned, including Int8 auto-keep selector with candidates:19 and selected:blocks.0.mlp.proj.weight, Int8 scale storage with fp32_tensors:8 and fp32_bytes:16384, Int8 min-clip override with tensors:9 baseline:1.00000 overrides:.mlp.fc.weight:0.25000, and Kept float storage with extra_fp32_tensors:9 and extra_fp32_extra_bytes:2359296; submission size stays essentially unchanged; and final_int8_zlib_roundtrip_exact improves below the current best kept 1.58402850 val_bpb and 2.67456578 val_loss. Falsify: throughput or step count shifts materially despite this lightweight change, any pinned serializer signal drifts unexpectedly, train_loss is clearly worse late in the run, or final exact round-trip metrics stay flat or worsen versus pgolf_0042, indicating that shrinking only the token embedding matrix does not improve the exported checkpoint. | pre_review_round=1
66	2026-04-12T19:04:48+00:00	gpt-5.4	gpt-5.4	pgolf_0066	error				5dc952355253ef2e4a018d3e3ed499f7246b5682	Add an opt-in decoupled weight decay term on the scalar/control Adam group and test a small nonzero SCALAR_WEIGHT_DECAY on top of the kept pgolf_0042 export stack.	SCALAR_WEIGHT_DECAY=0.005 INT8_KEEP_FLOAT_LARGE_NAME_PATTERNS=c_v.weight INT8_AUTO_KEEP_FLOAT_NAME_PATTERNS=tok_emb.weight,.attn.proj.weight,.mlp.proj.weight INT8_AUTO_KEEP_FLOAT_LOG_TOPK=5 INT8_FP32_SCALE_NAME_PATTERNS=.mlp.proj.weight INT8_MIN_CLIP_NAME_VALUE_OVERRIDES=.mlp.fc.weight:0.25 INT8_KEEP_FLOAT_FP32_EXTRA_NAME_PATTERNS=c_v.weight	This is one bounded training-side change in train_gpt.py. It adds SCALAR_WEIGHT_DECAY to Hyperparameters, validates it, switches only the scalar/control optimizer from Adam to AdamW when the value is positive, keeps the default zero-decay path on the existing Adam implementation, threads the configured weight_decay only to that scalar parameter group, and logs the configured value in the optimizer summary. The Muon matrix group, token embedding optimizer, model architecture, data loader, evaluation path, and serializer remain unchanged. | stage=experiment | error=remote training failed for run_id=pgolf_0066 with exit code 255 | hypothesis=The current best pgolf_0042 stack still leaves the fp32 scalar/control parameters in each block and the skip weights completely undecayed. Those parameters directly gate residual-path amplitudes through attn_scale, mlp_scale, resid_mix, q_gain, and skip_weights, so a short wallclock-limited run can end with slightly overgrown control magnitudes that hurt both raw generalization and the final int8 round-trip artifact even though the serializer path is unchanged. A small decoupled SCALAR_WEIGHT_DECAY applied only to that Adam group should modestly suppress late-step growth in those high-leverage gates without changing model shape, data exposure, tokenizer, or the established pgolf_0042 export stack. If the raw checkpoint ends with better-behaved residual/control scalars, final_int8_zlib_roundtrip_exact should improve. This mechanism is plausibly transferable to the full challenge regime because it is ordinary training-side regularization on a parameter family that steers activation scale, not exporter bookkeeping. | expected_signals=Support: the run logs scalar_weight_decay:0.005 in the optimizer summary; training throughput and measured step count stay in-family with the current frontier because the serializer path is unchanged; the established pgolf_0042 export-path signals remain pinned, including Int8 auto-keep selector with candidates:19 and selected:blocks.0.mlp.proj.weight, Int8 scale storage with fp32_tensors:8 and fp32_bytes:16384, Int8 min-clip override with tensors:9 baseline:1.00000 overrides:.mlp.fc.weight:0.25000, and Kept float storage with extra_fp32_tensors:9 and extra_fp32_extra_bytes:2359296; submission size stays essentially unchanged; and final_int8_zlib_roundtrip_exact improves below the current best kept 1.58402850 val_bpb and 2.67456578 val_loss. Falsify: throughput or step count shifts materially despite this lightweight change, any pinned serializer signal drifts unexpectedly, late train_loss is clearly worse, or final exact round-trip metrics stay flat or worsen versus pgolf_0042, indicating that shrinking the scalar/control group does not improve the exported checkpoint. | pre_review_round=1
