iteration	timestamp	model	review_model	run_id	decision	val_bpb	val_loss	size_bytes	commit	idea	env	notes
67	2026-04-12T19:10:41+00:00	gpt-5.4	gpt-5.4	pgolf_0067	error				0763b3ed21870bcf2786a9e51cd3b8cd7d0f82f4	Add an opt-in decoupled weight decay term to Muon's matrix-parameter group and test a small nonzero MATRIX_WEIGHT_DECAY on top of the kept pgolf_0042 export stack.	MATRIX_WEIGHT_DECAY=0.0005 INT8_KEEP_FLOAT_LARGE_NAME_PATTERNS=c_v.weight INT8_AUTO_KEEP_FLOAT_NAME_PATTERNS=tok_emb.weight,.attn.proj.weight,.mlp.proj.weight INT8_AUTO_KEEP_FLOAT_LOG_TOPK=5 INT8_FP32_SCALE_NAME_PATTERNS=.mlp.proj.weight INT8_MIN_CLIP_NAME_VALUE_OVERRIDES=.mlp.fc.weight:0.25 INT8_KEEP_FLOAT_FP32_EXTRA_NAME_PATTERNS=c_v.weight	This is one bounded training-side change in train_gpt.py. It adds MATRIX_WEIGHT_DECAY to Hyperparameters, validates and threads it through Muon, applies decoupled decay only on the Muon matrix-parameter update path immediately before the normalized update is applied, and logs the configured value. The Adam groups, model architecture, data loader, evaluation path, and serializer remain unchanged. This intentionally retries the previously infra-failed matrix-decay idea on top of the kept pgolf_0042 stack rather than introducing a broader mixed change. | stage=experiment | error=remote training failed for run_id=pgolf_0067 with exit code 255 | hypothesis=The current best stack is still a short wallclock-limited trainer with no explicit shrinkage on the large transformer block matrices that dominate both parameter count and post-training int8 error. A small decoupled MATRIX_WEIGHT_DECAY applied only to Muon's matrix group should slightly suppress late-training weight growth and outliers in those matrices without changing model shape, data order, or the established export path. If that produces a smoother raw checkpoint with better-behaved large weights, the final int8 round-trip metric should improve. This mechanism is plausibly transferable to the full regime because it is a standard training-side regularization change rather than exporter bookkeeping. | expected_signals=Support: the run logs matrix_weight_decay:0.0005 in the optimizer summary; training throughput and measured step count stay in-family with the current export-only frontier because the serializer path is unchanged; the established pgolf_0042 export-path signals remain pinned, including Int8 auto-keep selector with candidates:19 and selected:blocks.0.mlp.proj.weight, Int8 scale storage with fp32_tensors:8 and fp32_bytes:16384, Int8 min-clip override with tensors:9 baseline:1.00000 overrides:.mlp.fc.weight:0.25000, and Kept float storage with extra_fp32_tensors:9 and extra_fp32_extra_bytes:2359296; submission size stays essentially unchanged; and final_int8_zlib_roundtrip_exact improves below the current best kept 1.58402850 val_bpb and 2.67456578 val_loss. Falsify: throughput or step count shifts materially despite this lightweight optimizer change, the run diverges or shows clearly worse train_loss behavior, any pinned serializer signal drifts unexpectedly, or final exact round-trip metrics stay flat or worsen versus pgolf_0042, indicating that shrinking the Muon-managed matrices does not improve the exported checkpoint. | pre_review_round=1
68	2026-04-12T19:36:44+00:00	gpt-5.4	gpt-5.4	pgolf_0068	error				3344ace1a43790bf2cb188fbcc159e05b745cef4	Add an opt-in decoupled weight decay term to Muon's matrix-parameter group and test a small nonzero MATRIX_WEIGHT_DECAY on top of the kept pgolf_0042 export stack.	MATRIX_WEIGHT_DECAY=0.0005 INT8_KEEP_FLOAT_LARGE_NAME_PATTERNS=c_v.weight INT8_AUTO_KEEP_FLOAT_NAME_PATTERNS=tok_emb.weight,.attn.proj.weight,.mlp.proj.weight INT8_AUTO_KEEP_FLOAT_LOG_TOPK=5 INT8_FP32_SCALE_NAME_PATTERNS=.mlp.proj.weight INT8_MIN_CLIP_NAME_VALUE_OVERRIDES=.mlp.fc.weight:0.25 INT8_KEEP_FLOAT_FP32_EXTRA_NAME_PATTERNS=c_v.weight	This is one bounded training-side change in train_gpt.py. It adds MATRIX_WEIGHT_DECAY to Hyperparameters, validates and threads it through Muon, applies decoupled decay only on the Muon matrix-parameter update path immediately before the normalized update is applied, and logs the configured value. The Adam groups, model architecture, data loader, evaluation path, and serializer remain unchanged. Training was not run locally. | stage=experiment | error=remote training failed for run_id=pgolf_0068 with exit code 255 | hypothesis=The current best stack is still a short wallclock-limited trainer with no explicit shrinkage on the large transformer block matrices that dominate both parameter count and post-training int8 error. A small decoupled MATRIX_WEIGHT_DECAY applied only to Muon's matrix group should slightly suppress late-training weight growth and outliers in those matrices without changing model shape, data order, or the established export path. If that produces a smoother raw checkpoint with better-behaved large weights, the final int8 round-trip metric should improve. This mechanism is plausibly transferable to the full regime because it is a standard training-side regularization change rather than exporter bookkeeping. | expected_signals=Support: the run logs matrix_weight_decay:0.0005 in the optimizer summary; training throughput and measured step count stay in-family with the current export-only frontier because the serializer path is unchanged; the established pgolf_0042 export-path signals remain pinned, including Int8 auto-keep selector with candidates:19 and selected:blocks.0.mlp.proj.weight, Int8 scale storage with fp32_tensors:8 and fp32_bytes:16384, Int8 min-clip override with tensors:9 baseline:1.00000 overrides:.mlp.fc.weight:0.25000, and Kept float storage with extra_fp32_tensors:9 and extra_fp32_extra_bytes:2359296; submission size stays essentially unchanged; and final_int8_zlib_roundtrip_exact improves below the current best kept 1.58402850 val_bpb and 2.67456578 val_loss. Falsify: throughput or step count shifts materially despite this lightweight optimizer change, the run diverges or shows clearly worse train_loss behavior, any pinned serializer signal drifts unexpectedly, or final exact round-trip metrics stay flat or worsen versus pgolf_0042, indicating that shrinking the Muon-managed matrices does not improve the exported checkpoint. | pre_review_round=1
69	2026-04-12T19:39:22+00:00	gpt-5.4	gpt-5.4	pgolf_0069	error				0aab39030513500eb423d7b5cf28c29287b7d8bf	Add an opt-in decoupled weight decay term on the token-embedding optimizer group by switching that group from Adam to AdamW when EMBED_WEIGHT_DECAY is positive, then rerun the kept pgolf_0042 export stack with a small nonzero EMBED_WEIGHT_DECAY.	EMBED_WEIGHT_DECAY=0.002 INT8_KEEP_FLOAT_LARGE_NAME_PATTERNS=c_v.weight INT8_AUTO_KEEP_FLOAT_NAME_PATTERNS=tok_emb.weight,.attn.proj.weight,.mlp.proj.weight INT8_AUTO_KEEP_FLOAT_LOG_TOPK=5 INT8_FP32_SCALE_NAME_PATTERNS=.mlp.proj.weight INT8_MIN_CLIP_NAME_VALUE_OVERRIDES=.mlp.fc.weight:0.25 INT8_KEEP_FLOAT_FP32_EXTRA_NAME_PATTERNS=c_v.weight	This is one bounded training-side change in train_gpt.py. It adds EMBED_WEIGHT_DECAY to Hyperparameters, validates that it is non-negative, switches only the token embedding optimizer group from Adam to AdamW when the configured value is positive, keeps the default zero-decay path on the existing Adam implementation, threads weight_decay only to the token embedding parameter group, and logs the optimizer choice plus configured decay so pre-review can verify that the change is exactly an optimizer-group Adam-to-AdamW plus decoupled-decay ablation. The Muon matrix group, scalar/head optimizers, model architecture, data loader, evaluation path, and serializer remain unchanged. This intentionally resends the embedding-decay idea with tighter instrumentation because pgolf_0065 failed with an infrastructure-level exit and did not actually resolve the hypothesis. | stage=experiment | error=remote training failed for run_id=pgolf_0069 with exit code 255 | hypothesis=The current best pgolf_0042 stack still trains the tied token embedding matrix with Adam at a relatively large effective learning rate and no explicit shrinkage, even though that matrix directly controls both input representations and output logits and remains one of the dominant contributors to export sensitivity. Switching only the token-embedding group from Adam to AdamW with a small decoupled EMBED_WEIGHT_DECAY should modestly suppress late-run norm growth and outlier coefficients in that tied table without changing model shape, data order, or the established serializer path. If the prior pgolf_0065 infrastructure failure was external rather than algorithmic, this clean retry should resolve the previously unanswered hypothesis. The mechanism is plausibly transferable to the full challenge regime because it is ordinary optimizer-group regularization on a high-leverage parameter family, not exporter bookkeeping. | expected_signals=Support: the optimizer summary logs embed_optimizer:AdamW and embed_weight_decay:0.002; training throughput and measured step count stay in-family with the current frontier because the serializer path is unchanged; the pinned pgolf_0042 export-path signals remain unchanged, including Int8 auto-keep selector with candidates:19 and selected:blocks.0.mlp.proj.weight, Int8 scale storage with fp32_tensors:8 and fp32_bytes:16384, Int8 min-clip override with tensors:9 baseline:1.00000 overrides:.mlp.fc.weight:0.25000, and Kept float storage with extra_fp32_tensors:9 and extra_fp32_extra_bytes:2359296; submission size stays essentially unchanged; and final_int8_zlib_roundtrip_exact improves below the current best kept 1.58402850 val_bpb and 2.67456578 val_loss. Falsify: the run stays on embed_optimizer:Adam, throughput or step count shifts materially despite this light optimizer-group change, any pinned serializer signal drifts, late train_loss is clearly worse, or final exact metrics stay flat or worsen versus pgolf_0042, indicating that decoupled shrinkage on tok_emb alone is not the right next training-side lever. | pre_review_round=3
70	2026-04-12T19:39:50+00:00	gpt-5.4	gpt-5.4	pgolf_0070	error				d8662f7ed96498012627175f7922ccd02c1ba603	Add an opt-in decoupled weight decay term on the scalar/control Adam group and test a small nonzero SCALAR_WEIGHT_DECAY on top of the kept pgolf_0042 export stack.	SCALAR_WEIGHT_DECAY=0.005 INT8_KEEP_FLOAT_LARGE_NAME_PATTERNS=c_v.weight INT8_AUTO_KEEP_FLOAT_NAME_PATTERNS=tok_emb.weight,.attn.proj.weight,.mlp.proj.weight INT8_AUTO_KEEP_FLOAT_LOG_TOPK=5 INT8_FP32_SCALE_NAME_PATTERNS=.mlp.proj.weight INT8_MIN_CLIP_NAME_VALUE_OVERRIDES=.mlp.fc.weight:0.25 INT8_KEEP_FLOAT_FP32_EXTRA_NAME_PATTERNS=c_v.weight	This is one bounded training-side change in train_gpt.py. It adds SCALAR_WEIGHT_DECAY to Hyperparameters, validates it, switches only the scalar/control optimizer from Adam to AdamW when the value is positive, keeps the default zero-decay path on the existing Adam implementation, threads the configured weight_decay only to that scalar parameter group, and logs the configured value in the optimizer summary. The Muon matrix group, token embedding optimizer, model architecture, data loader, evaluation path, and serializer remain unchanged. Training was not run locally. | stage=experiment | error=remote training failed for run_id=pgolf_0070 with exit code 255 | hypothesis=The current best pgolf_0042 stack still leaves the fp32 scalar/control parameters in each block and the skip weights completely undecayed. Those parameters directly gate residual-path amplitudes through attn_scale, mlp_scale, resid_mix, q_gain, and skip_weights, so a short wallclock-limited run can end with slightly overgrown control magnitudes that hurt both raw generalization and the final int8 round-trip artifact even though the serializer path is unchanged. A small decoupled SCALAR_WEIGHT_DECAY applied only to that Adam group should modestly suppress late-step growth in those high-leverage gates without changing model shape, data exposure, tokenizer, or the established pgolf_0042 export stack. If the raw checkpoint ends with better-behaved residual/control scalars, final_int8_zlib_roundtrip_exact should improve. This mechanism is plausibly transferable to the full challenge regime because it is ordinary training-side regularization on a parameter family that steers activation scale, not exporter bookkeeping. | expected_signals=Support: the run logs scalar_weight_decay:0.005 in the optimizer summary; training throughput and measured step count stay in-family with the current frontier because the serializer path is unchanged; the established pgolf_0042 export-path signals remain pinned, including Int8 auto-keep selector with candidates:19 and selected:blocks.0.mlp.proj.weight, Int8 scale storage with fp32_tensors:8 and fp32_bytes:16384, Int8 min-clip override with tensors:9 baseline:1.00000 overrides:.mlp.fc.weight:0.25000, and Kept float storage with extra_fp32_tensors:9 and extra_fp32_extra_bytes:2359296; submission size stays essentially unchanged; and final_int8_zlib_roundtrip_exact improves below the current best kept 1.58402850 val_bpb and 2.67456578 val_loss. Falsify: throughput or step count shifts materially despite this lightweight change, any pinned serializer signal drifts unexpectedly, late train_loss is clearly worse, or final exact round-trip metrics stay flat or worsen versus pgolf_0042, indicating that shrinking the scalar/control group does not improve the exported checkpoint. | pre_review_round=1
