iteration	timestamp	model	review_model	run_id	decision	val_bpb	val_loss	size_bytes	commit	idea	env	notes
54	2026-04-12T17:43:45+00:00	gpt-5.4	gpt-5.4	pgolf_0054	error				c3222287dddc5b885358a9ecfaae759cf953b7d1	Add an audit-only current-path headroom ranking on top of the kept pgolf_0042 export stack that compares promoting the selected auto-kept `blocks.0.mlp.proj.weight` tensor from fp16 passthrough to fp32 against other exact-feasible one-more-tensor uses of the remaining submission budget.	INT8_KEEP_FLOAT_LARGE_NAME_PATTERNS=c_v.weight INT8_AUTO_KEEP_FLOAT_NAME_PATTERNS=tok_emb.weight,.attn.proj.weight,.mlp.proj.weight INT8_AUTO_KEEP_FLOAT_LOG_TOPK=5 INT8_FP32_SCALE_NAME_PATTERNS=.mlp.proj.weight INT8_MIN_CLIP_NAME_VALUE_OVERRIDES=.mlp.fc.weight:0.25 INT8_KEEP_FLOAT_FP32_EXTRA_NAME_PATTERNS=c_v.weight INT8_CURRENT_PATH_HEADROOM_AUDIT=1 INT8_CURRENT_PATH_HEADROOM_AUDIT_LOG_TOPK=5 INT8_CURRENT_PATH_HEADROOM_AUDIT_MIN_GAIN=0.00005 INT8_CURRENT_PATH_HEADROOM_AUDIT_MIN_MARGIN=0.00002 INT8_CURRENT_PATH_HEADROOM_AUDIT_MIN_FEASIBLE_ALTERNATIVES=1	This is one bounded audit-only serializer change in `train_gpt.py`. It adds an opt-in current-path headroom audit that reuses the unchanged baseline selector scoring for byte/gain reference, recomputes counterfactual gains on the actual pgolf_0042 export path, serializes each candidate counterfactual to get exact compressed submission bytes for cap checks, and logs the selected tensor's baseline selector bytes separately from its true current-path fp32-promotion bytes so the remote log can verify the intended `.mlp.proj.weight` counterfactual unambiguously under the live fp32-scale overrides. | stage=experiment | error=remote training failed for run_id=pgolf_0054 with exit code 255 | hypothesis=Under the live pgolf_0042 path, `blocks.0.mlp.proj.weight` is already the selected extra kept tensor but still stored through the default fp16 passthrough, while the remaining `tok_emb.weight,.attn.proj.weight,.mlp.proj.weight` family stays on the actual current quantized path with `.mlp.proj.weight` fp32 row scales and `.mlp.fc.weight:0.25` min-clip overrides. If the remaining loss from that final fp16 storage cast is still the best use of the leftover size headroom, then an audit against the exact current serializer state should show that promoting only the selected tensor to fp32 remains under the exact compressed submission cap and delivers more normalized-MAE gain than any other exact-feasible one-more-tensor keep-float alternative. | expected_signals=Support: the run remains export-only and keeps the established pgolf_0042 live-path logs pinned, including `Int8 auto-keep selector` with `candidates:19` and `selected:blocks.0.mlp.proj.weight`, `Int8 scale storage` with `fp32_tensors:8` and `fp32_bytes:16384`, `Int8 min-clip override` with `tensors:9 baseline:1.00000 overrides:.mlp.fc.weight:0.25000`, and `Kept float storage` with `extra_fp32_tensors:9` and `extra_fp32_extra_bytes:2359296`. The new audit then reports `Int8 current-path headroom audit` with a nonzero feasible set, `Int8 current-path selected bytes` where the selected tensor shows separate `selector_extra`, `current_base`, `current_whatif`, and `current_extra` fields, and `Int8 current-path feasible top` where the selected `blocks.0.mlp.proj.weight|kind=selected_fp32_promotion` is rank 1 among exact-feasible options. `Int8 current-path headroom thresholds` should show `selected_exact_total <= 16000000`, `selected_gain >= 0.00005000`, `selected_margin >= 0.00002000`, and `feasible_alternatives >= 1`, with `selected:blocks.0.mlp.proj.weight`. Falsify: the existing pgolf_0042 live-path logs drift unexpectedly, the selected-bytes line does not separate selector-path and current-path bytes, the audit finds no other exact-feasible alternatives, the selected exact total breaches the cap, or another exact-feasible alternative matches or beats the selected fp32 promotion so the audit logs `selected:none`. | pre_review_round=2
55	2026-04-12T17:43:48+00:00	gpt-5.4	gpt-5.4	pgolf_0055	error				9e537f333a43a7ab207a689d0770e5629a166baf	Add an audit-only int8 clip-percentile sweep for the still-quantized `.mlp.proj.weight` family on top of the kept `pgolf_0042` export stack, leaving the live serialized artifact unchanged while checking whether a lower row clip percentile beats the current near-max baseline across most of that family.	INT8_KEEP_FLOAT_LARGE_NAME_PATTERNS=c_v.weight INT8_AUTO_KEEP_FLOAT_NAME_PATTERNS=tok_emb.weight,.attn.proj.weight,.mlp.proj.weight INT8_AUTO_KEEP_FLOAT_LOG_TOPK=5 INT8_FP32_SCALE_NAME_PATTERNS=.mlp.proj.weight INT8_MIN_CLIP_NAME_VALUE_OVERRIDES=.mlp.fc.weight:0.25 INT8_KEEP_FLOAT_FP32_EXTRA_NAME_PATTERNS=c_v.weight INT8_CLIP_SWEEP_AUDIT_NAME_PATTERNS=.mlp.proj.weight INT8_CLIP_SWEEP_AUDIT_PERCENTILES=99.0,99.5,99.9,99.99 INT8_CLIP_SWEEP_AUDIT_LOG_TOPK=4 INT8_CLIP_SWEEP_AUDIT_MIN_TENSOR_GAIN=0.00001 INT8_CLIP_SWEEP_AUDIT_MIN_IMPROVED_TENSORS=6 INT8_CLIP_SWEEP_AUDIT_MIN_MEAN_GAIN=0.00002 INT8_CLIP_SWEEP_AUDIT_MIN_MEDIAN_GAIN=0.00001	This is one bounded audit-only serializer change in `train_gpt.py`. The patch adds validated parsing for `INT8_CLIP_SWEEP_AUDIT_*`, lets the quantizer replay alternate clip percentiles only inside the audit path, evaluates only large 2D tensors that remain quantized after the current keep-float and auto-keep decisions are fixed, and logs thresholded family summaries so pre-review can distinguish a real `.mlp.proj.weight` clipping signal from noise before any live override is attempted. The live serialization format, dequantization path, training math, optimizer behavior, and evaluation behavior are unchanged. | stage=experiment | error=remote training failed for run_id=pgolf_0055 with exit code 255 | hypothesis=After `pgolf_0042`, one `.mlp.proj.weight` tensor is already auto-kept in float and the remaining eight still-quantized `.mlp.proj.weight` tensors already use fp32 row scales, so the next plausible bottleneck for that family is the row clip percentile itself rather than scale dtype or the final keep-float storage cast. Because each row has only 512 columns, the current `99.99984` percentile is effectively max-like and may still let a few outliers inflate the row scale enough to waste int8 resolution on the bulk of each row. If a materially lower percentile such as `99.99`, `99.9`, `99.5`, or `99.0` is better under the exact current serializer state, then replaying the real quantizer with those alternatives should reduce normalized MAE across most of the eight still-quantized `.mlp.proj.weight` tensors without changing the live export path. | expected_signals=Support: the run stays export-only and in-family with `pgolf_0042`; `Int8 auto-keep selector` still reports `candidates:19` and `selected:blocks.0.mlp.proj.weight`; `Int8 scale storage` still reports `fp32_tensors:8` and `fp32_bytes:16384`; `Int8 min-clip override` still reports `tensors:9 baseline:1.00000 overrides:.mlp.fc.weight:0.25000`; `Kept float storage` still reports `extra_fp32_tensors:9` and `extra_fp32_extra_bytes:2359296`; the new `Int8 clip sweep audit` log reports `baseline:99.99984`, `tensors:8`, `candidates:4`, and a concrete `selected` percentile from `99.00000`, `99.50000`, `99.90000`, or `99.99000`; the paired thresholds log shows `selected_improved >= 6`, `selected_mean_gain >= 0.00002000`, and `selected_median_gain >= 0.00001000`; and the ranked candidate summary shows the same winner ahead of the other tested percentiles by a non-trivial margin. Falsify: `tensors` is not 8, the pre-existing live-path logs drift, the audit reports `selected:none`, or the best lower percentile fails those improved-count / mean-gain / median-gain gates, which would mean lower-percentile clipping is not a justified next live ablation for the still-quantized `.mlp.proj.weight` family under the current `pgolf_0042` stack. | pre_review_round=1
56	2026-04-12T17:43:52+00:00	gpt-5.4	gpt-5.4	pgolf_0056	error				99492a05dea9627c7d289ea63a1e1d073181bdcc	Add an audit-only exact current-path extra keep-float check for named tensors that still quantize under the kept pgolf_0042 export stack, and run it only on tok_emb.weight.	INT8_KEEP_FLOAT_LARGE_NAME_PATTERNS=c_v.weight INT8_AUTO_KEEP_FLOAT_NAME_PATTERNS=tok_emb.weight,.attn.proj.weight,.mlp.proj.weight INT8_AUTO_KEEP_FLOAT_LOG_TOPK=5 INT8_FP32_SCALE_NAME_PATTERNS=.mlp.proj.weight INT8_MIN_CLIP_NAME_VALUE_OVERRIDES=.mlp.fc.weight:0.25 INT8_KEEP_FLOAT_FP32_EXTRA_NAME_PATTERNS=c_v.weight INT8_KEEP_FLOAT_EXTRA_AUDIT_NAME_PATTERNS=tok_emb.weight	This is one bounded audit-only serializer change in train_gpt.py. It adds INT8_KEEP_FLOAT_EXTRA_AUDIT_NAME_PATTERNS, clones the already-built quantized artifact only for matched tensors that are still on the quantized path, promotes them to the existing baseline keep-float storage path without touching the live exported artifact, and recompresses that promoted copy so the audit reports exact submission-byte deltas in the same units as the cap. The intended run targets only tok_emb.weight because the previous pre-review specifically asked for exact extra-byte accounting before any live rescue on that tensor. | stage=experiment | error=remote training failed for run_id=pgolf_0056 with exit code 255 | hypothesis=Under the current pgolf_0042 export stack, tok_emb.weight still takes the standard per-row int8 path rather than a keep-float path. Its actual shape is 1024x512, so the current quantized payload should be 524288 int8 bytes plus 1024 fp16 row scales = 526336 bytes, while the baseline keep-float path would store it in float16 at 1048576 bytes, for an exact raw extra of 522240 bytes. If a live tok_emb.weight keep-float rescue is still submission-feasible, then replaying the exact current serializer state and temporarily promoting only that currently-quantized tensor to the existing baseline keep-float path should report those same raw byte counts and a recompressed promoted submission that stays under the 16000000-byte cap. If the exact audit disagrees with those bytes or the promoted submission breaches the cap, that falsifies tok_emb.weight as a trustworthy next live rescue target. | expected_signals=Support: the run stays export-only and in-family with pgolf_0042, including Int8 auto-keep selector still reporting candidates:19 and selected:blocks.0.mlp.proj.weight, Int8 scale storage still reporting fp32_tensors:8 and fp32_bytes:16384, Int8 min-clip override still reporting tensors:9 baseline:1.00000 overrides:.mlp.fc.weight:0.25000, and Kept float storage still reporting extra_fp32_tensors:9 and extra_fp32_extra_bytes:2359296 for c_v.weight. The new Int8 extra keep-float audit log should report tensors:1, patterns:tok_emb.weight, matched:tok_emb.weight, quantized_payload:526336, keep_payload:1048576, and extra_raw_bytes:522240. The paired Int8 extra keep-float audit bytes log should report exact baseline_submission and promoted_submission totals, with extra_submission measured from the recompressed promoted artifact and remaining_after still non-negative. Falsify: tok_emb.weight is not matched from the current quantized path, the raw payload numbers differ from 526336 / 1048576 / 522240, any of the pinned pgolf_0042 live-path logs drift unexpectedly, or the exact promoted_submission exceeds the size cap so remaining_after is negative. | pre_review_round=3
57	2026-04-12T17:43:55+00:00	gpt-5.4	gpt-5.4	pgolf_0057	error				2c937f82a6b10177dca314c32bbb7b839695f778	Add an audit-only current-path int8 clip-percentile sweep for named still-quantized tensor families, and run it only on `.attn.proj.weight` on top of the kept pgolf_0042 export stack with an exact `INT8_CLIP_SWEEP_AUDIT_REQUIRE_MATCHED_TENSORS=9` guard.	INT8_KEEP_FLOAT_LARGE_NAME_PATTERNS=c_v.weight INT8_AUTO_KEEP_FLOAT_NAME_PATTERNS=tok_emb.weight,.attn.proj.weight,.mlp.proj.weight INT8_AUTO_KEEP_FLOAT_LOG_TOPK=5 INT8_FP32_SCALE_NAME_PATTERNS=.mlp.proj.weight INT8_MIN_CLIP_NAME_VALUE_OVERRIDES=.mlp.fc.weight:0.25 INT8_KEEP_FLOAT_FP32_EXTRA_NAME_PATTERNS=c_v.weight INT8_CLIP_SWEEP_AUDIT_NAME_PATTERNS=.attn.proj.weight INT8_CLIP_SWEEP_AUDIT_PERCENTILES=99.99990,99.99992,99.99995,99.99998 INT8_CLIP_SWEEP_AUDIT_LOG_TOPK=4 INT8_CLIP_SWEEP_AUDIT_REQUIRE_MATCHED_TENSORS=9 INT8_CLIP_SWEEP_AUDIT_MIN_TENSOR_GAIN=0.00002000 INT8_CLIP_SWEEP_AUDIT_MIN_IMPROVED_TENSORS=6 INT8_CLIP_SWEEP_AUDIT_MIN_MEAN_GAIN=0.00002000 INT8_CLIP_SWEEP_AUDIT_MIN_MEDIAN_GAIN=0.00002000	This is one bounded audit-only serializer change in `train_gpt.py`. It rebases the clip-sweep audit onto the current live tree, keeps the exported artifact on the existing pgolf_0042 path, reuses the current quantization helpers including fp32-scale and min-clip overrides, adds nil-safe handling for empty matches, and exposes the live `INT8_CLIP_SWEEP_AUDIT_REQUIRE_MATCHED_TENSORS` signal so pre-review can verify this is the exact nine-tensor `.attn.proj.weight` family check rather than a broader or duplicate live mechanism. | stage=experiment | error=remote training failed for run_id=pgolf_0057 with exit code 255 | hypothesis=The kept pgolf_0042 stack already preserves `c_v.weight` in fp32, auto-keeps `blocks.0.mlp.proj.weight`, stores fp32 row scales for the remaining quantized `.mlp.proj.weight` tensors, and applies the `.mlp.fc.weight:0.25` live min-clip override. If a real current-path clip-percentile improvement still exists in the nine still-quantized `.attn.proj.weight` tensors, then replaying the exact live quantization path through the new audit-only `audit_clip_sweep_family` helper should show one higher percentile beating the live `99.99984` baseline across that family. If the family no longer benefits under the actual pgolf_0042 stack, the audit should explicitly report `selected:none` while leaving the live artifact unchanged. | expected_signals=Support: the run stays export-only and in-family with pgolf_0042; `Int8 auto-keep selector` still reports `candidates:19` and `selected:blocks.0.mlp.proj.weight`; `Int8 scale storage` still reports `fp32_tensors:8` and `fp32_bytes:16384`; `Int8 min-clip override` still reports `tensors:9 baseline:1.00000 overrides:.mlp.fc.weight:0.25000`; `Kept float storage` still reports `extra_fp32_tensors:9` and `extra_fp32_extra_bytes:2359296`; the new `Int8 clip sweep audit` log reports `baseline:99.99984`, `tensors:9`, `candidates:4`, and either a concrete selected percentile from `99.99990,99.99992,99.99995,99.99998` or `selected:none`; `Int8 clip sweep thresholds` reports `require_tensors:9` and the configured family gates; and `Int8 clip sweep candidates` plus `Int8 clip sweep tensors` show whether the focused `.attn.proj.weight` family has a real positive current-path margin. Falsify: matched tensor count is not 9, any pinned pgolf_0042 live-path signal drifts unexpectedly, or the audit reports `selected:none` with non-positive or weak family gains, which would mean `.attn.proj.weight` is not a trustworthy current-path clip-percentile follow-up under the actual pgolf_0042 stack. | pre_review_round=3
58	2026-04-12T17:43:58+00:00	gpt-5.4	gpt-5.4	pgolf_0058	error				02a81b299dae4bcdb92c321ca96e4e6f2f570e4a	Add an audit-only exact current-path fp32-scale family check for the still-quantized `.attn.c_k.weight` tensors on top of the kept `pgolf_0042` export stack, leaving the live serialized artifact unchanged and only surfacing `fp32` as actionable if explicit family-wide gates clear.	INT8_KEEP_FLOAT_LARGE_NAME_PATTERNS=c_v.weight INT8_AUTO_KEEP_FLOAT_NAME_PATTERNS=tok_emb.weight,.attn.proj.weight,.mlp.proj.weight INT8_AUTO_KEEP_FLOAT_LOG_TOPK=5 INT8_FP32_SCALE_NAME_PATTERNS=.mlp.proj.weight INT8_MIN_CLIP_NAME_VALUE_OVERRIDES=.mlp.fc.weight:0.25 INT8_KEEP_FLOAT_FP32_EXTRA_NAME_PATTERNS=c_v.weight INT8_FP32_SCALE_AUDIT_NAME_PATTERNS=.attn.c_k.weight INT8_FP32_SCALE_AUDIT_LOG_TOPK=9 INT8_FP32_SCALE_AUDIT_REQUIRE_MATCHED_TENSORS=9 INT8_FP32_SCALE_AUDIT_MIN_TENSOR_GAIN=0.00002 INT8_FP32_SCALE_AUDIT_MIN_IMPROVED_TENSORS=6 INT8_FP32_SCALE_AUDIT_MIN_MEAN_GAIN=0.00002 INT8_FP32_SCALE_AUDIT_MIN_MEDIAN_GAIN=0.00002	This is one bounded audit-only serializer change in `train_gpt.py`. The live quantization path, serialized artifact, dequantization path, selector scoring rule, training math, optimizer behavior, and evaluation behavior are unchanged. The patch adds a named fp32-scale family audit that excludes already-kept tensors and any tensors already on the live fp32-scale path, reuses the exact current min-clip behavior for each matched tensor, enforces an exact matched-count guard, and logs family-wide plus per-tensor gains so pre-review can decide whether `.attn.c_k.weight` deserves any future live fp32-scale override. | stage=experiment | error=remote training failed for run_id=pgolf_0058 with exit code 255 | hypothesis=The kept `pgolf_0042` stack already preserves `c_v.weight` in fp32, auto-keeps one `.mlp.proj.weight`, stores fp32 row scales for the other eight quantized `.mlp.proj.weight` tensors, and lowers the `.mlp.fc.weight` min-clip floor to `0.25`. Earlier evidence already falsified live fp32-scale overrides for `tok_emb.weight` and `.attn.proj.weight`, and a current-stack audit falsified `.mlp.fc.weight`, so one remaining unresolved fp32-scale family is `.attn.c_k.weight`. Because key projections feed the shared KV path used by every query position while remaining fully quantized in the live stack, fp16 rounding of their saved per-row scales could still contribute measurable round-trip error. If that residual is real under the exact current path, then replaying the live quantization with fp32 row scales only for the nine `.attn.c_k.weight` tensors should show broad positive normalized-MAE gain across that family rather than isolated micro-noise. That signal would justify a later live override; failure to clear the gates should drop this family. | expected_signals=Support: the run stays export-only and in-family with `pgolf_0042`; `Int8 auto-keep selector` still reports `candidates:19` and `selected:blocks.0.mlp.proj.weight`; `Int8 scale storage` still reports `fp32_tensors:8` and `fp32_bytes:16384`; `Int8 min-clip override` still reports `tensors:9 baseline:1.00000 overrides:.mlp.fc.weight:0.25000`; `Kept float storage` still reports `extra_fp32_tensors:9` and `extra_fp32_extra_bytes:2359296`; the new `Int8 fp32-scale audit` log reports `tensors:9`, `selected:fp32` or `selected:none`, `patterns:.attn.c_k.weight`, and `extra_scale_bytes:9216`; `Int8 fp32-scale thresholds` reports `require_tensors:9`, `min_tensor_gain:0.00002000`, `min_improved_tensors:6`, `min_mean_gain:0.00002000`, and `min_median_gain:0.00002000`; and `Int8 fp32-scale candidates` lists all 9 matched tensors because `INT8_FP32_SCALE_AUDIT_LOG_TOPK=9`. Falsify: the audit matches anything other than exactly 9 tensors, the pinned `pgolf_0042` live-path logs drift unexpectedly, `extra_scale_bytes` is not `9216`, or the family summary fails the improved-count / mean-gain / median-gain gates and therefore logs `selected:none`. | pre_review_round=3
59	2026-04-12T17:52:36+00:00	gpt-5.4	gpt-5.4	pgolf_0059	error				5c88bb1908aa13fff0d9c34e45690e96e601e7e8	Add an opt-in audit-only train-shard coverage report that logs the exact measured shard and token consumption of the current sorted loader path and compares that same token budget against deterministic seed-shuffled and seed-rotated shard orders without changing live training or export behavior.	TRAIN_SHARD_ORDER_AUDIT=1 TRAIN_SHARD_ORDER_AUDIT_LOG_TOPK=4	This is one bounded audit-only change in train_gpt.py. It does not alter model math, optimizer settings, training order, validation, serialization, or the exported artifact. The patch instruments TokenStream to count real measured shard usage, then replays only shard-length metadata through deterministic counterfactual orderings so the remote log can quantify prefix bias without turning this round into another confounded live data-order ablation. | stage=experiment | error=remote training failed for run_id=pgolf_0059 with exit code 255 | hypothesis=The round-1 shard-shuffle idea should not be spent as a live ablation unless the current stack is first shown to consume a narrow lexicographic shard prefix under the real 600-second training path. Because the measured loader resets after warmup and then streams sorted shards contiguously, this audit can establish whether the actual run only touches a tiny early-shard subset and whether alternative deterministic orders would cover different shards for the exact same consumed token budget. If the audit shows strong sorted-prefix concentration, that supports a real data-order mechanism worth testing later and is plausibly transferable to the full regime because it measures training-data exposure rather than serializer bookkeeping. If it shows broad current coverage or little difference versus alternative deterministic orders, that falsifies shard-order work for this stack. | expected_signals=Support: the new train_shard_usage line reports the exact measured stream_tokens, unique_shards, wraps, lexicographic_prefix_share, first_shards, and top_shards; stream_tokens exceeds nominal optimizer tokens only by the expected next-token overlap; unique_shards is a small subset of total train shards; and the paired train_shard_order_audit lines for mode:sorted, mode:seed_shuffle, and mode:seed_rotate all keep the same stream_tokens while the live sorted path shows concentrated early-shard exposure with lexicographic_prefix_share near 1.0 and the alternative orders show materially different first_shards plus lower lexicographic-prefix share. Falsify: the current run already covers a broad shard set or wraps enough that the sorted path is not concentrated, the exact stream-token accounting is inconsistent, or the alternative deterministic orders produce nearly the same shard-coverage summary as the live sorted path, which would mean the proposed startup-shuffle mechanism is not well supported under the real current stack. | pre_review_round=2
