iteration	timestamp	model	review_model	run_id	decision	val_bpb	val_loss	size_bytes	commit	idea	env	notes
30	2026-03-20T09:31:40+00:00	gpt-5.4	gpt-5.4	pgolf_0030	error				8e750def93f714b897eeede2953826b5aec75a27	Add an opt-in tensor-name int8 clip-percentile override for live export, keep the current pgolf_0014-style auto-keep scorer pinned to its baseline fp16-scale clip path, and test a slightly higher clip percentile only on the still-quantized `.mlp.fc.weight` tensors.	INT8_KEEP_FLOAT_LARGE_NAME_PATTERNS=c_v.weight INT8_AUTO_KEEP_FLOAT_NAME_PATTERNS=tok_emb.weight,.attn.proj.weight,.mlp.proj.weight INT8_AUTO_KEEP_FLOAT_LOG_TOPK=5 INT8_FP32_SCALE_NAME_PATTERNS=.mlp.proj.weight INT8_CLIP_PERCENTILE_OVERRIDES=.mlp.fc.weight:99.99992	This is one bounded serializer-only change in `train_gpt.py`. It adds `INT8_CLIP_PERCENTILE_OVERRIDES`, threads the selected clip quantile through the live int8 quantizer, keeps auto-keep candidate scoring fixed on the existing baseline clip path so the selector remains causal, and logs the exact count of tensors that used a clip override so the run can be audited directly from the remote log. | stage=experiment | error=remote training failed for run_id=pgolf_0030 with exit code 255 | hypothesis=pgolf_0014 already removed a large part of the remaining export error by keeping `c_v.weight` in float, auto-keeping one `.mlp.proj.weight`, and storing fp32 row scales for the other eight quantized MLP projections. The later fp32-scale and grouped-scale audits on the remaining fp16-scale tensor families came back with no positive winner, which suggests scale precision and within-row grouping are not the next bottleneck there. A more likely residual source is rare large coefficients getting clipped in the nine still-quantized `.mlp.fc.weight` expansion matrices. If only those tensors use a slightly higher live-export clip percentile while selector scoring stays on the unchanged baseline path, the exporter should preserve more of those tails without changing training behavior or the chosen auto-kept tensor, improving `final_int8_zlib_roundtrip_exact` versus pgolf_0014. | expected_signals=Support: the run completes normally with export-only throughput still in-family with pgolf_0014; `Int8 auto-keep selector` still reports `candidates:19` and `selected:blocks.0.mlp.proj.weight`; `Int8 scale storage` still reports `fp32_tensors:8` and `fp32_bytes:16384`; the new `Int8 clip overrides` log reports exactly `tensors:9`, confirming that only the nine `.mlp.fc.weight` tensors used the override; submission size stays close to pgolf_0014 because clipping does not add payload bytes; and final exact round-trip metrics improve below val_bpb 1.58718007 and val_loss 2.67988706. Falsify: the selector changes, the clip-override log does not report exactly `tensors:9`, the fp32-scale audit changes unexpectedly, size shifts materially, or final exact metrics stay flat or worsen versus pgolf_0014. | pre_review_round=1
31	2026-03-20T10:07:27+00:00	gpt-5.4	gpt-5.4	pgolf_0031	infra_retry				35005a450ce6cc1e46d65f30491560450a9ae863	Add an audit-only int8 clip-percentile sweep for the still-quantized `.mlp.fc.weight` family, keeping the live pgolf_0014 export path unchanged while scoring widely separated clipping regimes under the current serializer state and only flagging a regime as actionable if it clears explicit gain and support thresholds.	INT8_KEEP_FLOAT_LARGE_NAME_PATTERNS=c_v.weight INT8_AUTO_KEEP_FLOAT_NAME_PATTERNS=tok_emb.weight,.attn.proj.weight,.mlp.proj.weight INT8_AUTO_KEEP_FLOAT_LOG_TOPK=5 INT8_FP32_SCALE_NAME_PATTERNS=.mlp.proj.weight INT8_CLIP_PERCENTILE_AUDIT_NAME_PATTERNS=.mlp.fc.weight INT8_CLIP_PERCENTILE_AUDIT_VALUES=99.9,99.99,99.999,99.9999,99.99999 INT8_CLIP_PERCENTILE_AUDIT_MIN_GAIN=0.00005 INT8_CLIP_PERCENTILE_AUDIT_MIN_SUPPORT_FRAC=0.3334 INT8_CLIP_PERCENTILE_AUDIT_MIN_MEAN_GAIN=0.00002	This is one bounded serializer-only change in `train_gpt.py`. The patch adds validated parsing for an audit-only clip-percentile sweep, lets the quantizer score alternate percentiles without changing the live export path, evaluates only large still-quantized matched 2D tensors after the current auto-keep decision is fixed, and logs both the threshold configuration and a ranked per-percentile summary so pre-review can distinguish a real family-level signal from isolated or near-zero noise. | stage=experiment | error=remote worker reported that CUDA is required | retry_after_seconds=3.0 | hypothesis=pgolf_0014 already preserved `c_v.weight`, auto-kept one `.mlp.proj.weight`, and upgraded the other quantized `.mlp.proj.weight` tensors to fp32 row scales, while later audits found no credible win from scale-precision or grouped-scale changes on the remaining families. That leaves clipping of rare large coefficients in the nine still-quantized `.mlp.fc.weight` expansion matrices as a plausible residual source of export error. If a materially different clip regime really helps this family, the current serializer-state audit should show a non-trivial normalized-MAE gain on several of those tensors at once, not just near-zero noise on one tensor. Using a per-tensor support threshold of 0.00005 normalized-MAE gain, a family mean-gain threshold of 0.00002, and a minimum support fraction of 0.3334 should separate a real family-level effect from the ~1e-8 numerical-noise wins that already failed review. | expected_signals=Support: the run remains export-only and in-family with pgolf_0014; `Int8 auto-keep selector` still reports `candidates:19` and `selected:blocks.0.mlp.proj.weight`; `Int8 scale storage` still reports `fp32_tensors:8` and `fp32_bytes:16384`; `Int8 clip percentile audit` reports `tensors:9`, `percentiles:5`, `min_gain:0.00005000`, `min_support_count:4`, and `min_mean_gain:0.00002000`; and the audit chooses a non-`none` percentile whose summary line shows at least `support=4/9` with `mean` at or above `0.00002000`. Falsify: the audit matches fewer than 9 tensors, the existing pgolf_0014 export-path logs change unexpectedly, or every swept percentile either stays below 4 supported tensors at the 0.00005 gain floor or stays below the 0.00002 family mean-gain floor, which would mean there is no trustworthy family-wide clipping win to promote into a later live ablation. | pre_review_round=3
32	2026-03-20T10:07:43+00:00	gpt-5.4	gpt-5.4	pgolf_0032	infra_retry				dddda7e12ffa0ce8e58402a0a832f9d9bb48bcd0	Add an audit-only int8 clip-percentile sweep for the still-quantized `.mlp.fc.weight` family, keeping the live pgolf_0014 export path unchanged while scoring widely separated clipping regimes under the current serializer state and only flagging a regime as actionable if it clears explicit gain and support thresholds.	INT8_KEEP_FLOAT_LARGE_NAME_PATTERNS=c_v.weight INT8_AUTO_KEEP_FLOAT_NAME_PATTERNS=tok_emb.weight,.attn.proj.weight,.mlp.proj.weight INT8_AUTO_KEEP_FLOAT_LOG_TOPK=5 INT8_FP32_SCALE_NAME_PATTERNS=.mlp.proj.weight INT8_CLIP_PERCENTILE_AUDIT_NAME_PATTERNS=.mlp.fc.weight INT8_CLIP_PERCENTILE_AUDIT_VALUES=99.9,99.99,99.999,99.9999,99.99999 INT8_CLIP_PERCENTILE_AUDIT_MIN_GAIN=0.00005 INT8_CLIP_PERCENTILE_AUDIT_MIN_SUPPORT_FRAC=0.3334 INT8_CLIP_PERCENTILE_AUDIT_MIN_MEAN_GAIN=0.00002	This is one bounded serializer-only change in `train_gpt.py`. The patch adds validated parsing for an audit-only clip-percentile sweep, lets the quantizer score alternate percentiles without changing the live export path, evaluates only large still-quantized matched 2D tensors after the current auto-keep decision is fixed, and logs both the threshold configuration and a ranked per-percentile summary so pre-review can distinguish a real family-level signal from isolated or near-zero noise. | stage=experiment | error=remote worker reported that CUDA is required | retry_after_seconds=30.0 | hypothesis=pgolf_0014 already preserved `c_v.weight`, auto-kept one `.mlp.proj.weight`, and upgraded the other quantized `.mlp.proj.weight` tensors to fp32 row scales, while later audits found no credible win from scale-precision or grouped-scale changes on the remaining families. That leaves clipping of rare large coefficients in the nine still-quantized `.mlp.fc.weight` expansion matrices as a plausible residual source of export error. If a materially different clip regime really helps this family, the current serializer-state audit should show a non-trivial normalized-MAE gain on several of those tensors at once, not just near-zero noise on one tensor. Using a per-tensor support threshold of 0.00005 normalized-MAE gain, a family mean-gain threshold of 0.00002, and a minimum support fraction of 0.3334 should separate a real family-level effect from the ~1e-8 numerical-noise wins that already failed review. | expected_signals=Support: the run remains export-only and in-family with pgolf_0014; `Int8 auto-keep selector` still reports `candidates:19` and `selected:blocks.0.mlp.proj.weight`; `Int8 scale storage` still reports `fp32_tensors:8` and `fp32_bytes:16384`; `Int8 clip percentile audit` reports `tensors:9`, `percentiles:5`, `min_gain:0.00005000`, `min_support_count:4`, and `min_mean_gain:0.00002000`; and the audit chooses a non-`none` percentile whose summary line shows at least `support=4/9` with `mean` at or above `0.00002000`. Falsify: the audit matches fewer than 9 tensors, the existing pgolf_0014 export-path logs change unexpectedly, or every swept percentile either stays below 4 supported tensors at the 0.00005 gain floor or stays below the 0.00002 family mean-gain floor, which would mean there is no trustworthy family-wide clipping win to promote into a later live ablation. | pre_review_round=3
33	2026-03-20T10:16:59+00:00	gpt-5.4	gpt-5.4	pgolf_0033	error				ed3efc914de3c1702513268821b93ccc36dd41bc	Add an audit-only int8 clip-percentile sweep for the still-quantized `.mlp.fc.weight` family, keeping the live pgolf_0014 export path unchanged while scoring widely separated clipping regimes under the current serializer state and only flagging a regime as actionable if it clears explicit gain and support thresholds.	INT8_KEEP_FLOAT_LARGE_NAME_PATTERNS=c_v.weight INT8_AUTO_KEEP_FLOAT_NAME_PATTERNS=tok_emb.weight,.attn.proj.weight,.mlp.proj.weight INT8_AUTO_KEEP_FLOAT_LOG_TOPK=5 INT8_FP32_SCALE_NAME_PATTERNS=.mlp.proj.weight INT8_CLIP_PERCENTILE_AUDIT_NAME_PATTERNS=.mlp.fc.weight INT8_CLIP_PERCENTILE_AUDIT_VALUES=99.9,99.99,99.999,99.9999,99.99999 INT8_CLIP_PERCENTILE_AUDIT_MIN_GAIN=0.00005 INT8_CLIP_PERCENTILE_AUDIT_MIN_SUPPORT_FRAC=0.3334 INT8_CLIP_PERCENTILE_AUDIT_MIN_MEAN_GAIN=0.00002	This is one bounded serializer-only change in `train_gpt.py`. The patch adds validated parsing for an audit-only clip-percentile sweep, lets the quantizer score alternate percentiles without changing the live export path, evaluates only large still-quantized matched 2D tensors after the current auto-keep decision is fixed, and logs both the threshold configuration and a ranked per-percentile summary so pre-review can distinguish a real family-level signal from isolated or near-zero noise. | stage=experiment | error=remote training failed for run_id=pgolf_0033 with exit code 255 | hypothesis=pgolf_0014 already preserved `c_v.weight`, auto-kept one `.mlp.proj.weight`, and upgraded the other quantized `.mlp.proj.weight` tensors to fp32 row scales, while later audits found no credible win from scale-precision or grouped-scale changes on the remaining families. That leaves clipping of rare large coefficients in the nine still-quantized `.mlp.fc.weight` expansion matrices as a plausible residual source of export error. If a materially different clip regime really helps this family, the current serializer-state audit should show a non-trivial normalized-MAE gain on several of those tensors at once, not just near-zero noise on one tensor. Using a per-tensor support threshold of 0.00005 normalized-MAE gain, a family mean-gain threshold of 0.00002, and a minimum support fraction of 0.3334 should separate a real family-level effect from the ~1e-8 numerical-noise wins that already failed review. | expected_signals=Support: the run remains export-only and in-family with pgolf_0014; `Int8 auto-keep selector` still reports `candidates:19` and `selected:blocks.0.mlp.proj.weight`; `Int8 scale storage` still reports `fp32_tensors:8` and `fp32_bytes:16384`; `Int8 clip percentile audit` reports `tensors:9`, `percentiles:5`, `min_gain:0.00005000`, `min_support_count:4`, and `min_mean_gain:0.00002000`; and the audit chooses a non-`none` percentile whose summary line shows at least `support=4/9` with `mean` at or above `0.00002000`. Falsify: the audit matches fewer than 9 tensors, the existing pgolf_0014 export-path logs change unexpectedly, or every swept percentile either stays below 4 supported tensors at the 0.00005 gain floor or stays below the 0.00002 family mean-gain floor, which would mean there is no trustworthy family-wide clipping win to promote into a later live ablation. | pre_review_round=3
34	2026-03-20T10:17:10+00:00	gpt-5.4	gpt-5.4	pgolf_0034	error				6df12d9aa27ff809a231a1738cfaad729857215f	Add an audit-only int8 clip-percentile sweep for the still-quantized `.mlp.fc.weight` family, keeping the live pgolf_0014 export path unchanged while scoring a bounded set of clearly separated lower clip percentiles against the fixed 99.99984 baseline and only naming a winner if the gain is supported across most of the family.	INT8_KEEP_FLOAT_LARGE_NAME_PATTERNS=c_v.weight INT8_AUTO_KEEP_FLOAT_NAME_PATTERNS=tok_emb.weight,.attn.proj.weight,.mlp.proj.weight INT8_AUTO_KEEP_FLOAT_LOG_TOPK=5 INT8_FP32_SCALE_NAME_PATTERNS=.mlp.proj.weight INT8_CLIP_SWEEP_AUDIT_NAME_PATTERNS=.mlp.fc.weight INT8_CLIP_SWEEP_AUDIT_PERCENTILES=99.0,99.5,99.9,99.99 INT8_CLIP_SWEEP_AUDIT_LOG_TOPK=4 INT8_CLIP_SWEEP_AUDIT_MIN_TENSOR_GAIN=0.0001 INT8_CLIP_SWEEP_AUDIT_MIN_IMPROVED_TENSORS=6 INT8_CLIP_SWEEP_AUDIT_MIN_MEAN_GAIN=0.0005 INT8_CLIP_SWEEP_AUDIT_MIN_MEDIAN_GAIN=0.0001	This is one bounded audit-only change in `train_gpt.py`. It adds validated parsing for `INT8_CLIP_SWEEP_AUDIT_PERCENTILES`, threads an explicit `clip_q` only through audit scoring, reuses the existing quantize/dequantize helpers so the comparison stays on the real serializer math, audits only tensors that remain quantized after the current keep-float and auto-keep decisions, and logs ranked per-percentile family summaries plus strict family-level gating. The serialized artifact format, live quantization path, dequantization path, training math, optimizer behavior, and evaluation behavior are unchanged. | stage=experiment | error=remote training failed for run_id=pgolf_0034 with exit code 255 | hypothesis=pgolf_0014 already keeps `c_v.weight` in float, auto-keeps one `.mlp.proj.weight`, and stores fp32 row scales for the other eight quantized `.mlp.proj.weight` tensors, while recent fp32-scale, grouped-scale, and axis audits on the remaining fp16-scale families found no credible positive winner. That makes the next plausible bottleneck for the nine still-quantized `.mlp.fc.weight` tensors the baseline near-max per-row clip setting itself: with 512 columns per row, `99.99984` is effectively max-based and may let a few outliers inflate the row scale enough to waste int8 resolution on the bulk of the weights. If materially lower clip percentiles really help this family, then an audit against the actual current serializer state should show the same lower percentile beating the fixed baseline on a clear majority of the nine tensors with non-trivial mean and median normalized-MAE gains. If the sweep stays flat or only shows tiny isolated wins, that falsifies the lower-percentile `.mlp.fc.weight` follow-up instead of merely failing to distinguish values packed around the old baseline. | expected_signals=Support: the live export logs stay in-family with pgolf_0014, including `Int8 auto-keep selector` still choosing `blocks.0.mlp.proj.weight`, `Int8 scale storage` still reporting `fp32_tensors:8` and `fp32_bytes:16384`, and submission size staying close to pgolf_0014 because the patch is audit-only; the new `Int8 clip sweep audit` log reports `baseline:99.99984`, `tensors:9`, `candidates:4`, and `selected` equal to exactly one of `99.00000`, `99.50000`, `99.90000`, or `99.99000`; the paired `Int8 clip sweep thresholds` log shows that any selected percentile cleared the stricter family bar with at least `selected_improved:6`, `selected_mean_gain >= 0.00050000`, and `selected_median_gain >= 0.00010000`; and the `Int8 clip sweep candidates` summary shows the winning percentile beating the baseline across most of the family rather than by a single-tensor or near-zero edge. Falsify: the live export path changes unexpectedly, `tensors` is not 9, `selected:none`, or the candidate summary only shows tiny/noisy gains that fail the family thresholds, which would mean lower-percentile clipping is not a justified next live ablation for `.mlp.fc.weight`. | pre_review_round=3
35	2026-03-20T10:17:22+00:00	gpt-5.4	gpt-5.4	pgolf_0035	error				fb885f9348e1717ccc6c76d7237de3da3ef3fd76	Add a live-export-only fp32 keep-float override env for named passthrough tensors, keep the auto-keep scorer pinned to the baseline fp16 keep-float path, and rerun the existing pgolf_0014 stack with only the already-kept `c_v.weight` tensors promoted from fp16 passthrough to fp32.	INT8_KEEP_FLOAT_LARGE_NAME_PATTERNS=c_v.weight INT8_AUTO_KEEP_FLOAT_NAME_PATTERNS=tok_emb.weight,.attn.proj.weight,.mlp.proj.weight INT8_AUTO_KEEP_FLOAT_LOG_TOPK=5 INT8_FP32_SCALE_NAME_PATTERNS=.mlp.proj.weight INT8_KEEP_FLOAT_FP32_EXTRA_NAME_PATTERNS=c_v.weight	This is one bounded serializer-only change in `train_gpt.py`. It adds `INT8_KEEP_FLOAT_FP32_EXTRA_NAME_PATTERNS`, threads that extra override only through the live passthrough export path, keeps `score_keep_float_candidate` on the baseline keep-float behavior so the existing auto-keep selection remains causal, and logs both total fp32 kept-float payload and the subset newly promoted by the extra override so pre-review can verify that the `c_v.weight` fp32 rerun is trustworthy. | stage=experiment | error=remote training failed for run_id=pgolf_0035 with exit code 255 | hypothesis=pgolf_0014 already established that the current best serializer path keeps `c_v.weight` in float, auto-keeps one `.mlp.proj.weight`, and stores fp32 row scales for the remaining quantized `.mlp.proj.weight` tensors. The previous-round attempt to test fp32 passthrough on `c_v.weight` was not causal because the fp32 override also changed selector scoring. If the remaining exact round-trip loss on the already-kept `c_v.weight` family is materially coming from the final fp16 storage cast rather than from selector behavior, then adding a separate live-export-only `INT8_KEEP_FLOAT_FP32_EXTRA_NAME_PATTERNS` path should preserve only those nine passthrough tensors in fp32 while leaving candidate scoring on the baseline fp16 keep-float path, improving `final_int8_zlib_roundtrip_exact` versus pgolf_0014. | expected_signals=Support: the run completes normally with export-only throughput still in-family with pgolf_0014; `Int8 auto-keep selector` still reports `candidates:19` and `selected:blocks.0.mlp.proj.weight`; `Int8 scale storage` still reports `fp32_tensors:8` and `fp32_bytes:16384`; the new `Kept float storage` log reports `extra_fp32_tensors:9` with `extra_fp32_extra_bytes:1175040`, confirming that only the nine already-kept `c_v.weight` tensors were newly promoted from baseline fp16 passthrough to fp32 while selector scoring stayed on the old path; total submission size rises by about 1175040 bytes versus pgolf_0014 but stays under 16000000; and final exact round-trip metrics improve below val_bpb 1.58718007 and val_loss 2.67988706. Falsify: the selector changes, the new kept-float audit does not report exactly `extra_fp32_tensors:9` and `extra_fp32_extra_bytes:1175040`, the fp32-scale audit changes unexpectedly, size growth is materially different from the expected fp16->fp32 delta for nine `c_v.weight` tensors, or final exact metrics stay flat or worsen versus pgolf_0014. | pre_review_round=2
