iteration	timestamp	model	review_model	run_id	decision	val_bpb	val_loss	size_bytes	commit	idea	env	notes
48	2026-03-20T16:44:28+00:00	gpt-5.4	gpt-5.4	pgolf_0048	revert	1.58416454	2.67479547	15201147	bb85a7ef8fbe7a64ee6bbf630dd80eb0309fd12d	Add a live-only baseline keep-float passthrough override for named large tensors, keep the existing auto-keep selector scoring on its established baseline path, and test preserving only `blocks.1.mlp.proj.weight` in float16 on top of the kept `pgolf_0042` export stack.	INT8_KEEP_FLOAT_LARGE_NAME_PATTERNS=c_v.weight INT8_AUTO_KEEP_FLOAT_NAME_PATTERNS=tok_emb.weight,.attn.proj.weight,.mlp.proj.weight INT8_AUTO_KEEP_FLOAT_LOG_TOPK=5 INT8_FP32_SCALE_NAME_PATTERNS=.mlp.proj.weight INT8_MIN_CLIP_NAME_VALUE_OVERRIDES=.mlp.fc.weight:0.25 INT8_KEEP_FLOAT_FP32_EXTRA_NAME_PATTERNS=c_v.weight INT8_KEEP_FLOAT_BASELINE_EXTRA_NAME_PATTERNS=blocks.1.mlp.proj.weight	This is one bounded serializer-only change in `train_gpt.py`. It adds `INT8_KEEP_FLOAT_BASELINE_EXTRA_NAME_PATTERNS`, lets explicitly named large tensors bypass int8 on the live export path while still using the existing baseline keep-float storage path, keeps the auto-keep scorer unchanged, and logs exact tensor-count/payload/extra-byte accounting for the added baseline keep-float override so pre-review can verify that only the intended tensor was rescued. | hypothesis=The kept `pgolf_0042` stack already promotes `c_v.weight` to fp32, auto-keeps `blocks.0.mlp.proj.weight`, stores fp32 row scales for the remaining quantized `.mlp.proj.weight` tensors, and lowers the `.mlp.fc.weight` min-clip floor to 0.25. The reverted `pgolf_0043` audit still provided useful current-path evidence: among the remaining quantized large tensors under that exact stack, `blocks.1.mlp.proj.weight` ranked first globally with estimated keep-float gain about 0.20346476 and the same bounded extra payload as the already-selected `blocks.0.mlp.proj.weight`. If that current-path ranking is causal rather than just diagnostic, then adding a live-only baseline keep-float override for just `blocks.1.mlp.proj.weight` should remove another large residual-writeback quantization error and improve `final_int8_zlib_roundtrip_exact` versus `pgolf_0042` without changing training behavior or the selector choice. | expected_signals=Support: the run completes normally with export-only throughput still in-family with `pgolf_0042`; `Int8 auto-keep selector` still reports `candidates:19` and `selected:blocks.0.mlp.proj.weight`; `Int8 scale storage` still reports `fp32_tensors:8` and `fp32_bytes:16384`; `Int8 min-clip override` still reports `tensors:9 baseline:1.00000 overrides:.mlp.fc.weight:0.25000`; `Kept float storage` still reports `extra_fp32_tensors:9` and `extra_fp32_extra_bytes:2359296` for `c_v.weight`; the new `Kept float baseline storage` log reports `extra_tensors:1` with `patterns:blocks.1.mlp.proj.weight` and `extra_bytes_vs_quantized` close to the current-path audit expectation for one `.mlp.proj.weight`; total submission size stays below 16000000 bytes; and final exact round-trip metrics improve below val_bpb 1.58402850 and val_loss 2.67456578. Falsify: the selector changes, the new baseline-keep log does not report exactly one matched tensor for `blocks.1.mlp.proj.weight`, the existing fp32-scale/min-clip/c_v fp32 logs drift unexpectedly, size breaches the cap, or final exact metrics stay flat or worsen versus `pgolf_0042`. | pre_review_round=1 | post_review=Revert: pgolf_0048 is internally consistent enough to score, but it does not improve on the best prior kept result and it also drifts from the expected pinned export signals, so it is not a trustworthy or worthwhile retained change.
49	2026-03-20T16:44:55+00:00	gpt-5.4	gpt-5.4	pgolf_0049	infra_retry				b6e7ca9cede5ffa3a120d3824d93a1dfb1daba8a	Add a live-only named extra keep-float override for large tensors, keep the current auto-keep selector and existing fp32/min-clip behavior unchanged, and test preserving only `blocks.0.attn.proj.weight` in float16 on top of the kept `pgolf_0042` export stack.	INT8_KEEP_FLOAT_LARGE_NAME_PATTERNS=c_v.weight INT8_AUTO_KEEP_FLOAT_NAME_PATTERNS=tok_emb.weight,.attn.proj.weight,.mlp.proj.weight INT8_AUTO_KEEP_FLOAT_LOG_TOPK=5 INT8_FP32_SCALE_NAME_PATTERNS=.mlp.proj.weight INT8_MIN_CLIP_NAME_VALUE_OVERRIDES=.mlp.fc.weight:0.25 INT8_KEEP_FLOAT_FP32_EXTRA_NAME_PATTERNS=c_v.weight INT8_KEEP_FLOAT_EXTRA_NAME_PATTERNS=blocks.0.attn.proj.weight	This is one bounded serializer-only change in `train_gpt.py`. The patch adds `INT8_KEEP_FLOAT_EXTRA_NAME_PATTERNS`, forces only those matched large tensors onto the existing keep-float path after the current stack has already decided the baseline large keeps and single auto-keep tensor, computes exact extra payload bytes against the live current quantized path rather than the older selector proxy, and logs the count plus byte delta so pre-review can verify that only the intended extra tensor moved out of int8. | stage=experiment | error=remote worker reported that CUDA is required | retry_after_seconds=3.0 | hypothesis=The kept `pgolf_0042` path already preserves `c_v.weight` in fp32, auto-keeps `blocks.0.mlp.proj.weight`, stores fp32 row scales for the remaining quantized `.mlp.proj.weight` tensors, and lowers the min-clip floor for `.mlp.fc.weight`. The `pgolf_0043` current-path keep audit then ranked `blocks.0.attn.proj.weight` as the strongest non-MLP residual-path tensor still left on the quantized path, with estimated gain `0.16866699` at only `261120` extra payload bytes. If that audit signal is causal, then adding one explicit live keep-float override for `blocks.0.attn.proj.weight` should recover complementary residual-path export error beyond the current stack and improve `final_int8_zlib_roundtrip_exact` versus `pgolf_0042` without changing training behavior. | expected_signals=Support: the run stays export-only and in-family with `pgolf_0042`; `Int8 auto-keep selector` still reports `candidates:19` and `selected:blocks.0.mlp.proj.weight`; `Int8 scale storage` still reports `fp32_tensors:8` and `fp32_bytes:16384`; `Int8 min-clip override` still reports `tensors:9 baseline:1.00000 overrides:.mlp.fc.weight:0.25000`; `Kept float storage` still reports `extra_fp32_tensors:9` and `extra_fp32_extra_bytes:2359296`; the new `Int8 extra keep-float` log reports `tensors:1`, `extra_bytes:261120`, and `patterns:blocks.0.attn.proj.weight`; total submission size stays below `16000000`; and final exact metrics improve below `val_bpb 1.58402850` and `val_loss 2.67456578`. Falsify: the selector changes, the new log does not report exactly one extra kept tensor with `extra_bytes:261120`, the existing fp32-scale/min-clip/c_v fp32 logs drift unexpectedly, size breaches the cap, or final exact metrics stay flat or worsen versus `pgolf_0042`. | pre_review_round=1
50	2026-03-20T16:45:18+00:00	gpt-5.4	gpt-5.4	pgolf_0050	infra_retry				d30f08325912f65df64214189892ab34c6d51b26	Add a live-only named extra keep-float override for large tensors, keep the current auto-keep selector and existing fp32/min-clip behavior unchanged, and test preserving only `blocks.0.attn.proj.weight` in float16 on top of the kept `pgolf_0042` export stack.	INT8_KEEP_FLOAT_LARGE_NAME_PATTERNS=c_v.weight INT8_AUTO_KEEP_FLOAT_NAME_PATTERNS=tok_emb.weight,.attn.proj.weight,.mlp.proj.weight INT8_AUTO_KEEP_FLOAT_LOG_TOPK=5 INT8_FP32_SCALE_NAME_PATTERNS=.mlp.proj.weight INT8_MIN_CLIP_NAME_VALUE_OVERRIDES=.mlp.fc.weight:0.25 INT8_KEEP_FLOAT_FP32_EXTRA_NAME_PATTERNS=c_v.weight INT8_KEEP_FLOAT_EXTRA_NAME_PATTERNS=blocks.0.attn.proj.weight	This is one bounded serializer-only change in `train_gpt.py`. The patch adds `INT8_KEEP_FLOAT_EXTRA_NAME_PATTERNS`, forces only those matched large tensors onto the existing keep-float path after the current stack has already decided the baseline large keeps and single auto-keep tensor, computes exact extra payload bytes against the live current quantized path rather than the older selector proxy, and logs the count plus byte delta so pre-review can verify that only the intended extra tensor moved out of int8. | stage=experiment | error=remote worker reported that CUDA is required | retry_after_seconds=30.0 | hypothesis=The kept `pgolf_0042` path already preserves `c_v.weight` in fp32, auto-keeps `blocks.0.mlp.proj.weight`, stores fp32 row scales for the remaining quantized `.mlp.proj.weight` tensors, and lowers the min-clip floor for `.mlp.fc.weight`. The `pgolf_0043` current-path keep audit then ranked `blocks.0.attn.proj.weight` as the strongest non-MLP residual-path tensor still left on the quantized path, with estimated gain `0.16866699` at only `261120` extra payload bytes. If that audit signal is causal, then adding one explicit live keep-float override for `blocks.0.attn.proj.weight` should recover complementary residual-path export error beyond the current stack and improve `final_int8_zlib_roundtrip_exact` versus `pgolf_0042` without changing training behavior. | expected_signals=Support: the run stays export-only and in-family with `pgolf_0042`; `Int8 auto-keep selector` still reports `candidates:19` and `selected:blocks.0.mlp.proj.weight`; `Int8 scale storage` still reports `fp32_tensors:8` and `fp32_bytes:16384`; `Int8 min-clip override` still reports `tensors:9 baseline:1.00000 overrides:.mlp.fc.weight:0.25000`; `Kept float storage` still reports `extra_fp32_tensors:9` and `extra_fp32_extra_bytes:2359296`; the new `Int8 extra keep-float` log reports `tensors:1`, `extra_bytes:261120`, and `patterns:blocks.0.attn.proj.weight`; total submission size stays below `16000000`; and final exact metrics improve below `val_bpb 1.58402850` and `val_loss 2.67456578`. Falsify: the selector changes, the new log does not report exactly one extra kept tensor with `extra_bytes:261120`, the existing fp32-scale/min-clip/c_v fp32 logs drift unexpectedly, size breaches the cap, or final exact metrics stay flat or worsen versus `pgolf_0042`. | pre_review_round=1
51	2026-03-20T17:01:28+00:00	gpt-5.4	gpt-5.4	pgolf_0051	revert	1.58699288	2.67957101	14798172	054d08ca288fac17514669b83449affb909cfd4d	Add a live-only named extra keep-float override for large tensors, keep the current auto-keep selector and existing fp32/min-clip behavior unchanged, and test preserving only `blocks.0.attn.proj.weight` in float16 on top of the kept `pgolf_0042` export stack.	INT8_KEEP_FLOAT_LARGE_NAME_PATTERNS=c_v.weight INT8_AUTO_KEEP_FLOAT_NAME_PATTERNS=tok_emb.weight,.attn.proj.weight,.mlp.proj.weight INT8_AUTO_KEEP_FLOAT_LOG_TOPK=5 INT8_FP32_SCALE_NAME_PATTERNS=.mlp.proj.weight INT8_MIN_CLIP_NAME_VALUE_OVERRIDES=.mlp.fc.weight:0.25 INT8_KEEP_FLOAT_FP32_EXTRA_NAME_PATTERNS=c_v.weight INT8_KEEP_FLOAT_EXTRA_NAME_PATTERNS=blocks.0.attn.proj.weight	This is one bounded serializer-only change in `train_gpt.py`. The patch adds `INT8_KEEP_FLOAT_EXTRA_NAME_PATTERNS`, forces only those matched large tensors onto the existing keep-float path after the current stack has already decided the baseline large keeps and single auto-keep tensor, computes exact extra payload bytes against the live current quantized path rather than the older selector proxy, and logs the count plus byte delta so pre-review can verify that only the intended extra tensor moved out of int8. | hypothesis=The kept `pgolf_0042` path already preserves `c_v.weight` in fp32, auto-keeps `blocks.0.mlp.proj.weight`, stores fp32 row scales for the remaining quantized `.mlp.proj.weight` tensors, and lowers the min-clip floor for `.mlp.fc.weight`. The `pgolf_0043` current-path keep audit then ranked `blocks.0.attn.proj.weight` as the strongest non-MLP residual-path tensor still left on the quantized path, with estimated gain `0.16866699` at only `261120` extra payload bytes. If that audit signal is causal, then adding one explicit live keep-float override for `blocks.0.attn.proj.weight` should recover complementary residual-path export error beyond the current stack and improve `final_int8_zlib_roundtrip_exact` versus `pgolf_0042` without changing training behavior. | expected_signals=Support: the run stays export-only and in-family with `pgolf_0042`; `Int8 auto-keep selector` still reports `candidates:19` and `selected:blocks.0.mlp.proj.weight`; `Int8 scale storage` still reports `fp32_tensors:8` and `fp32_bytes:16384`; `Int8 min-clip override` still reports `tensors:9 baseline:1.00000 overrides:.mlp.fc.weight:0.25000`; `Kept float storage` still reports `extra_fp32_tensors:9` and `extra_fp32_extra_bytes:2359296`; the new `Int8 extra keep-float` log reports `tensors:1`, `extra_bytes:261120`, and `patterns:blocks.0.attn.proj.weight`; total submission size stays below `16000000`; and final exact metrics improve below `val_bpb 1.58402850` and `val_loss 2.67456578`. Falsify: the selector changes, the new log does not report exactly one extra kept tensor with `extra_bytes:261120`, the existing fp32-scale/min-clip/c_v fp32 logs drift unexpectedly, size breaches the cap, or final exact metrics stay flat or worsen versus `pgolf_0042`. | pre_review_round=1 | post_review=Revert: pgolf_0051 is internally consistent and the new named extra keep-float override fired exactly as intended, but the live change regresses the best prior kept exact round-trip result from pgolf_0042 on both primary metrics, so it is not a real improvement worth keeping.
52	2026-03-20T17:50:12+00:00	gpt-5.4	gpt-5.4	pgolf_0052	revert	1.58642863	2.67861828	14442209	34d471f4ad731935ffda300abe0e5dabead09fc4	Add an audit-only exact current-path int8 clip-percentile sweep for the still-quantized `.mlp.proj.weight` tensors on top of the kept `pgolf_0042` export stack, comparing the baseline `99.99984` against higher candidates and only surfacing a winner if explicit family-level gates clear.	INT8_KEEP_FLOAT_LARGE_NAME_PATTERNS=c_v.weight INT8_AUTO_KEEP_FLOAT_NAME_PATTERNS=tok_emb.weight,.attn.proj.weight,.mlp.proj.weight INT8_AUTO_KEEP_FLOAT_LOG_TOPK=5 INT8_FP32_SCALE_NAME_PATTERNS=.mlp.proj.weight INT8_MIN_CLIP_NAME_VALUE_OVERRIDES=.mlp.fc.weight:0.25 INT8_KEEP_FLOAT_FP32_EXTRA_NAME_PATTERNS=c_v.weight INT8_CLIP_SWEEP_AUDIT_NAME_PATTERNS=.mlp.proj.weight INT8_CLIP_SWEEP_AUDIT_PERCENTILES=99.99988,99.99992,99.99996 INT8_CLIP_SWEEP_AUDIT_LOG_TOPK=3 INT8_CLIP_SWEEP_AUDIT_REQUIRE_MATCHED_TENSORS=8 INT8_CLIP_SWEEP_AUDIT_MIN_TENSOR_GAIN=0.00002 INT8_CLIP_SWEEP_AUDIT_MIN_IMPROVED_TENSORS=6 INT8_CLIP_SWEEP_AUDIT_MIN_MEAN_GAIN=0.00002 INT8_CLIP_SWEEP_AUDIT_MIN_MEDIAN_GAIN=0.00002	This is one bounded audit-only serializer change in `train_gpt.py`. The live quantization path, serialized artifact, dequantization path, selector scoring rule, training math, optimizer behavior, and evaluation behavior are unchanged. The patch factors `clip_q` into the existing quantizer helper, reuses the exact current-path scale-dtype and min-clip logic during audit scoring, excludes the already auto-kept `.mlp.proj.weight` tensor so the audit checks exactly the still-quantized family, and logs both family summaries and per-tensor gains for the best candidate even when the audit rejects all candidates with `selected:none`. | hypothesis=The kept `pgolf_0042` stack already preserves `c_v.weight` in fp32, auto-keeps one `.mlp.proj.weight`, stores fp32 row scales for the remaining quantized `.mlp.proj.weight` tensors, and lowers the `.mlp.fc.weight` minimum clip floor to `0.25`. That leaves eight still-quantized `.mlp.proj.weight` tensors on the exact live path. If some residual exact round-trip loss now comes from clipping rare large coefficients in that family, then replaying the real current quantization path at slightly higher clip percentiles should reduce normalized MAE versus the fixed `99.99984` baseline across most of those eight tensors at once. If the gains are sparse, tiny, or the audit does not match exactly eight tensors, this direction should be dropped instead of promoted into a live override. | expected_signals=Support: the run stays export-only and in-family with `pgolf_0042`; `Int8 auto-keep selector` still reports `candidates:19` and `selected:blocks.0.mlp.proj.weight`; `Int8 scale storage` still reports `fp32_tensors:8` and `fp32_bytes:16384`; `Int8 min-clip override` still reports `tensors:9 baseline:1.00000 overrides:.mlp.fc.weight:0.25000`; `Kept float storage` still reports `extra_fp32_tensors:9` and `extra_fp32_extra_bytes:2359296`; the new `Int8 clip sweep audit` log reports `baseline:99.99984`, `tensors:8`, `candidates:3`, and either a concrete selected percentile from `99.99988`, `99.99992`, or `99.99996` or `selected:none`; `Int8 clip sweep thresholds` reports `require_tensors:8`, `selected_improved >= 6`, `selected_mean_gain >= 0.00002000`, and `selected_median_gain >= 0.00002000` only when a winner is named; and the paired `Int8 clip sweep candidates` plus `Int8 clip sweep tensors` logs show whether the best candidate beats baseline broadly across the eight matched tensors rather than from one noisy row. Falsify: the audit matches anything other than exactly eight tensors, the established `pgolf_0042` live-path logs drift unexpectedly, or the best higher percentile fails the improved-count / mean-gain / median-gain gates and therefore logs `selected:none`. | pre_review_round=2 | post_review=Revert: pgolf_0052 is internally consistent and trustworthy as an audit-only run, but it regresses the best prior kept exact round-trip result and the new clip-sweep audit cleanly falsifies the hypothesis by selecting no higher percentile for the eight still-quantized .mlp.proj.weight tensors.
53	2026-03-20T18:50:24+00:00	gpt-5.4	gpt-5.4	pgolf_0053	revert	1.59786621	2.69793016	9084566	5d23f24c208061b458b90aa969e04d65a6c00b03	Store per-row int8 quantization scales in fp32 instead of fp16.		Bounded exporter-only ablation. The only code change is saving per-row int8 scales as fp32 rather than fp16; model shape, optimizer, tokenizer, data order, and training schedule remain unchanged. Verification in this clone was limited to python syntax checking via py_compile. | hypothesis=The current exporter quantizes every large matrix row with an int8 payload plus a saved row scale, but those scales are themselves rounded to fp16 before round-trip evaluation. Keeping per-row scales in fp32 should remove that secondary quantization error across all large matrices while adding only a small number of bytes, improving final_int8_zlib_roundtrip_exact val_bpb without changing training behavior or the raw pre-export checkpoint. | expected_signals=Support: raw training and pre-export validation metrics stay in the baseline range because training is unchanged, final_int8_zlib_roundtrip_exact val_bpb improves below the 2.34674946 baseline, and the int8+zlib artifact grows only modestly while remaining well under the 16000000-byte cap. Falsify: final_int8_zlib_roundtrip_exact val_bpb is unchanged or worse, or artifact bytes rise materially without a compensating round-trip metric gain. | pre_review_round=1 | post_review=Revert: pgolf_0053 appears mechanically trustworthy as an exporter-only run, but it regresses far behind the best prior kept result and does not provide a clearly worthwhile retained change.
