iteration	timestamp	model	review_model	run_id	decision	val_bpb	val_loss	size_bytes	commit	idea	env	notes
36	2026-03-20T10:51:24+00:00	gpt-5.4	gpt-5.4	pgolf_0036	revert	1.58869042	2.68243722	11317744	8100d37850e800b3ca2ebf82c2072320914c91da	Add an audit-only minimum-clip sweep for the still-quantized `.mlp.fc.weight` family, keep the live pgolf_0014 export path unchanged, and log both how often the current per-row `1.0 / 127.0` scale floor is active and whether any lower minimum clip values beat that exact baseline quantizer/dequantizer by a clear family-level margin.	INT8_KEEP_FLOAT_LARGE_NAME_PATTERNS=c_v.weight INT8_AUTO_KEEP_FLOAT_NAME_PATTERNS=tok_emb.weight,.attn.proj.weight,.mlp.proj.weight INT8_AUTO_KEEP_FLOAT_LOG_TOPK=5 INT8_FP32_SCALE_NAME_PATTERNS=.mlp.proj.weight INT8_MIN_CLIP_AUDIT_NAME_PATTERNS=.mlp.fc.weight INT8_MIN_CLIP_AUDIT_VALUES=0.25,0.5,0.75 INT8_MIN_CLIP_AUDIT_LOG_TOPK=4 INT8_MIN_CLIP_AUDIT_MIN_ROW_GAIN=0.0001 INT8_MIN_CLIP_AUDIT_MIN_IMPROVED_ROWS=128 INT8_MIN_CLIP_AUDIT_MIN_IMPROVED_TENSORS=4 INT8_MIN_CLIP_AUDIT_MIN_MEAN_TENSOR_GAIN=0.00002	This is one bounded audit-only serializer change in `train_gpt.py`. The live quantization path, serialized format, dequantization path, training math, optimizer behavior, and evaluation behavior are unchanged. The patch factors the current per-row quantizer into a helper that can replay the exact baseline math with alternate `min_clip_value` settings for audit scoring only, computes row-level and tensor-level normalized-MAE gains on tensors that remain quantized after the existing keep-float and auto-keep decisions, and logs both baseline floor incidence and thresholded candidate summaries so a later live override is only justifiable if the audit produces a clear family-level winner. | hypothesis=In the current pgolf_0014 stack, the `.mlp.fc.weight` tensors still quantize with `scale = (clip_abs / 127.0).clamp_min(1.0 / 127.0)`. That means the stored per-row scale is floored when `clip_abs < 1.0`, even though the `clipped` threshold itself stays at the row quantile. If a meaningful part of the remaining export loss in the nine still-quantized `.mlp.fc.weight` tensors comes from that coarse stored-scale floor, then an audit on the real live serializer state should show many floor-active rows and a lower minimum clip value such as `0.25`, `0.5`, or `0.75` reducing reconstruction error on enough rows and tensors at once to clear explicit family-level thresholds. If the audit shows only sparse or tiny gains, that falsifies another live minimum-clip override for this family. | expected_signals=Support: the live export logs stay in-family with pgolf_0014, including `Int8 auto-keep selector` still choosing `blocks.0.mlp.proj.weight` and `Int8 scale storage` still reporting `fp32_tensors:8` and `fp32_bytes:16384`; the new `Int8 min-clip audit` log reports exactly `tensors:9`; `baseline_floor_rows` is materially non-zero for the matched `.mlp.fc.weight` rows; and the paired `Int8 min-clip thresholds` plus `Int8 min-clip candidates` logs show one of `0.25000`, `0.50000`, or `0.75000` clearing all configured gates with at least `selected_tensors >= 4`, `selected_rows >= 128`, and `selected_mean_tensor_gain >= 0.00002000`. Falsify: the audit matches fewer than 9 tensors, `baseline_floor_rows` is zero or negligible, the existing pgolf_0014 live-path logs change unexpectedly, or every candidate stays below the family thresholds so `selected:none` remains in the audit log. | pre_review_round=3 | post_review=Revert: pgolf_0036 is a trustworthy audit-only run, but it does not justify keeping commit 8100d37850e800b3ca2ebf82c2072320914c91da. The primary exact round-trip metric regressed versus the best prior kept result pgolf_0014, moving from val_bpb 1.58718007 / val_loss 2.67988706 at 11300604 bytes to val_bpb 1.58869042 / val_loss 2.68243722 at 11317744 bytes.
37	2026-03-20T11:10:09+00:00	gpt-5.4	gpt-5.4	pgolf_0037	keep	1.58521499	2.67656911	12221610	d302a085be82f2f59ef6bfbd228c5e8579d9d369	Add an opt-in tensor-name minimum clip override for int8 export, keep the current pgolf_0014 auto-keep selector pinned to its baseline quantization path, and test a lower live-export floor only on the still-quantized `.mlp.fc.weight` tensors.	INT8_KEEP_FLOAT_LARGE_NAME_PATTERNS=c_v.weight INT8_AUTO_KEEP_FLOAT_NAME_PATTERNS=tok_emb.weight,.attn.proj.weight,.mlp.proj.weight INT8_AUTO_KEEP_FLOAT_LOG_TOPK=5 INT8_FP32_SCALE_NAME_PATTERNS=.mlp.proj.weight INT8_MIN_CLIP_NAME_VALUE_OVERRIDES=.mlp.fc.weight:0.25	This is one bounded serializer-only change in `train_gpt.py`. It adds validated parsing for `INT8_MIN_CLIP_NAME_VALUE_OVERRIDES`, threads a per-tensor minimum clip value only through the live quantization path, keeps `score_keep_float_candidate` on the unchanged baseline `min_clip_value=1.0` path so the existing auto-keep choice remains causal, and logs how many quantized tensors actually used a non-baseline floor so pre-review can verify the `.mlp.fc.weight`-only override directly from the remote log. | hypothesis=The completed pgolf_0036 audit showed that in the current pgolf_0014 export stack all 9216 audited `.mlp.fc.weight` rows hit the baseline per-row minimum stored-scale floor implied by `scale.clamp_min(1.0 / 127.0)`, and every audited tensor improved when that floor was lowered, with `0.25` winning the family summary most strongly. If that audit signal is causal rather than merely diagnostic, then applying a live `0.25` minimum clip override only to the nine still-quantized `.mlp.fc.weight` tensors should preserve more small coefficients in those matrices without changing payload size or selector behavior, improving `final_int8_zlib_roundtrip_exact` versus pgolf_0014. | expected_signals=Support: the run completes normally with export-only throughput still in-family with pgolf_0014; `Int8 auto-keep selector` still reports `candidates:19` and `selected:blocks.0.mlp.proj.weight`; `Int8 scale storage` still reports `fp32_tensors:8` and `fp32_bytes:16384`; the new `Int8 min-clip override` log reports `tensors:9 baseline:1.00000 overrides:.mlp.fc.weight:0.25000`; total submission size stays close to pgolf_0014 because scale dtype and tensor counts are unchanged; and final exact round-trip metrics improve below val_bpb 1.58718007 and val_loss 2.67988706. Falsify: the override log does not report exactly 9 matched tensors, the selector or fp32-scale logs change unexpectedly, submission size shifts materially despite the payload format staying the same, or final exact metrics stay flat or worsen versus pgolf_0014. | pre_review_round=1 | post_review=Keep: pgolf_0037 looks trustworthy and improves the best prior kept exact round-trip result from val_bpb 1.58718007 / val_loss 2.67988706 to val_bpb 1.58521499 / val_loss 2.67656911 while staying under the 16000000-byte cap at 12221610 bytes.
38	2026-03-20T11:44:05+00:00	gpt-5.4	gpt-5.4	pgolf_0038	error				39934713dd32ddd2ca988fb076a9b7fb15f8122e	Add an audit-only int8 clip-percentile sweep for the still-quantized `.mlp.fc.weight` family, keeping the live `pgolf_0037` export path unchanged while scoring a bounded set of clearly separated lower clip percentiles against the fixed `99.99984` baseline and only naming a winner if it beats that baseline across most of the family by non-trivial mean and median normalized-MAE gains.	INT8_KEEP_FLOAT_LARGE_NAME_PATTERNS=c_v.weight INT8_AUTO_KEEP_FLOAT_NAME_PATTERNS=tok_emb.weight,.attn.proj.weight,.mlp.proj.weight INT8_AUTO_KEEP_FLOAT_LOG_TOPK=5 INT8_FP32_SCALE_NAME_PATTERNS=.mlp.proj.weight INT8_MIN_CLIP_NAME_VALUE_OVERRIDES=.mlp.fc.weight:0.25 INT8_CLIP_SWEEP_AUDIT_NAME_PATTERNS=.mlp.fc.weight INT8_CLIP_SWEEP_AUDIT_PERCENTILES=99.0,99.5,99.9,99.99 INT8_CLIP_SWEEP_AUDIT_LOG_TOPK=4 INT8_CLIP_SWEEP_AUDIT_MIN_TENSOR_GAIN=0.0001 INT8_CLIP_SWEEP_AUDIT_MIN_IMPROVED_TENSORS=6 INT8_CLIP_SWEEP_AUDIT_MIN_MEAN_GAIN=0.0005 INT8_CLIP_SWEEP_AUDIT_MIN_MEDIAN_GAIN=0.0001	This is one bounded audit-only change in `train_gpt.py`. The live quantization path, serialized artifact format, dequantization path, training math, optimizer behavior, and evaluation behavior are unchanged. The patch factors clip percentile into the existing quantizer helper, runs the audit only on tensors that remain quantized after the current keep-float and auto-keep decisions are fixed, reuses the real quantize/dequantize math for both baseline and candidate scoring, and logs ranked per-percentile family summaries plus explicit gating so pre-review can distinguish a real family-wide signal from noise before any live `.mlp.fc.weight` clip-percentile override is attempted. | stage=experiment | error=missing final metric line in /root/parameter-golf/remote_logs/pgolf_0038.log | hypothesis=The current frontier `pgolf_0037` already lowers the minimum stored-scale floor to `0.25` for `.mlp.fc.weight`, but it still uses the near-max row clip percentile `99.99984`. With only 512 columns per row, that percentile is effectively max-like and may still let a few outliers inflate the row scale enough to waste int8 resolution on the bulk of each row even after the minimum-clip fix. If a materially lower clip percentile really helps the nine still-quantized `.mlp.fc.weight` tensors under the exact current serializer state, then an audit run on top of the unchanged `pgolf_0037` stack should show the same lower percentile beating the fixed `99.99984` baseline on a clear majority of that family with non-trivial mean and median gains rather than isolated near-zero noise. If no percentile clears those gates, then a later live clip-percentile ablation should be dropped. | expected_signals=Support: the live export path stays in-family with `pgolf_0037`, including `Int8 auto-keep selector` still reporting `candidates:19` and `selected:blocks.0.mlp.proj.weight`, `Int8 scale storage` still reporting `fp32_tensors:8` and `fp32_bytes:16384`, and `Int8 min-clip override` still reporting `tensors:9 baseline:1.00000 overrides:.mlp.fc.weight:0.25000`; the new `Int8 clip sweep audit` log reports `baseline:99.99984`, `tensors:9`, `candidates:4`, and `selected` equal to exactly one of `99.00000`, `99.50000`, `99.90000`, or `99.99000`; the paired `Int8 clip sweep thresholds` log shows that any selected percentile cleared the family gate with at least `selected_improved:6`, `selected_mean_gain >= 0.00050000`, and `selected_median_gain >= 0.00010000`; and the ranked candidate summary shows that winner beating the baseline across most of the family instead of by a single-tensor or near-zero edge. Falsify: the live export logs change unexpectedly, `tensors` is not exactly 9, `selected:none`, or the candidate summary only shows tiny/noisy gains that fail the family thresholds, which would mean lower-percentile clipping is not a justified next live ablation for `.mlp.fc.weight` under the current `pgolf_0037` export state. | pre_review_round=2
39	2026-03-20T12:33:09+00:00	gpt-5.4	gpt-5.4	pgolf_0039	revert	1.58762650	2.68064084	12219814	f2a36b347436dedffc5c156441d0ef2e54639d08	Re-establish the missing `.mlp.fc.weight` clip-percentile evidence on top of the exact kept `pgolf_0037` export stack by re-adding the audit-only lower-percentile sweep with a clean `selected:none` path and explicit family-level gates that require a winner to beat the baseline across most of the nine tensors.	INT8_KEEP_FLOAT_LARGE_NAME_PATTERNS=c_v.weight INT8_AUTO_KEEP_FLOAT_NAME_PATTERNS=tok_emb.weight,.attn.proj.weight,.mlp.proj.weight INT8_AUTO_KEEP_FLOAT_LOG_TOPK=5 INT8_FP32_SCALE_NAME_PATTERNS=.mlp.proj.weight INT8_MIN_CLIP_NAME_VALUE_OVERRIDES=.mlp.fc.weight:0.25 INT8_CLIP_SWEEP_AUDIT_NAME_PATTERNS=.mlp.fc.weight INT8_CLIP_SWEEP_AUDIT_PERCENTILES=99.0,99.5,99.9,99.99 INT8_CLIP_SWEEP_AUDIT_LOG_TOPK=4 INT8_CLIP_SWEEP_AUDIT_MIN_TENSOR_GAIN=0.0001 INT8_CLIP_SWEEP_AUDIT_MIN_IMPROVED_TENSORS=7 INT8_CLIP_SWEEP_AUDIT_MIN_MEAN_GAIN=0.0005 INT8_CLIP_SWEEP_AUDIT_MIN_MEDIAN_GAIN=0.0001	This is one bounded audit-only serializer change in `train_gpt.py`. It reintroduces the `pgolf_0038` clip-percentile sweep on top of the exact kept `pgolf_0037` export path, threads an alternate clip percentile only through audit scoring, preserves the live serialized artifact and dequantization path, and fixes the prior crash by making `selected:none` a first-class logged outcome instead of attempting to cast a missing selected percentile to float after training. | hypothesis=`pgolf_0037` already fixed the `.mlp.fc.weight` minimum stored-scale floor by lowering it to `0.25`, but those nine tensors still use the near-max `99.99984` clip percentile. With 512 columns per row, that baseline percentile is effectively max-like and may still let a few outliers waste int8 range on the bulk of each row. If a lower percentile such as `99.99` really helps under the exact kept `pgolf_0037` serializer state, then the audit should show one specific lower percentile clearing explicit gates while improving at least 7 of the 9 matched `.mlp.fc.weight` tensors by a non-trivial normalized-MAE margin. If no candidate clears those gates, that falsifies a follow-up live percentile override. | expected_signals=Support: the run completes normally on the unchanged `pgolf_0037` live path; existing live-path logs stay stable with `Int8 auto-keep selector` still reporting `candidates:19` and `selected:blocks.0.mlp.proj.weight`, `Int8 scale storage` still reporting `fp32_tensors:8` and `fp32_bytes:16384`, and `Int8 min-clip override` still reporting `tensors:9 baseline:1.00000 overrides:.mlp.fc.weight:0.25000`; the new `Int8 clip sweep audit` log reports `baseline:99.99984`, `tensors:9`, `candidates:4`, and a concrete `selected` percentile from `99.00000`, `99.50000`, `99.90000`, or `99.99000`; the paired `Int8 clip sweep thresholds` log shows `selected_improved >= 7`, `selected_mean_gain >= 0.00050000`, and `selected_median_gain >= 0.00010000`; and the ranked `Int8 clip sweep candidates` summary shows the selected winner clearly above the other candidates rather than by a near-zero edge. Falsify: `tensors` is not exactly 9, the pre-existing live-path logs drift, the audit reports `selected:none`, or the best lower percentile fails the configured majority and gain thresholds. | pre_review_round=2 | post_review=Revert: pgolf_0039 is a trustworthy audit-only run, but it does not justify keeping commit f2a36b347436dedffc5c156441d0ef2e54639d08. The primary exact round-trip metric regressed versus the best prior kept result pgolf_0037, moving from val_bpb 1.58521499 / val_loss 2.67656911 at 12221610 bytes to val_bpb 1.58762650 / val_loss 2.68064084 at 12219814 bytes.
40	2026-03-20T12:48:18+00:00	gpt-5.4	gpt-5.4	pgolf_0040	revert	1.58627619	2.67836091	12226849	c65fbdeea6ed6a2621fc4a0c61e4b7247a08465d	Add an audit-only fp32-scale family gate for the still-quantized `.mlp.fc.weight` tensors on top of the kept `pgolf_0037` export stack, leaving the live serialized artifact unchanged while only naming a winner if the current-path gains are both non-trivial per tensor and supported across the family.	INT8_KEEP_FLOAT_LARGE_NAME_PATTERNS=c_v.weight INT8_AUTO_KEEP_FLOAT_NAME_PATTERNS=tok_emb.weight,.attn.proj.weight,.mlp.proj.weight INT8_AUTO_KEEP_FLOAT_LOG_TOPK=5 INT8_FP32_SCALE_NAME_PATTERNS=.mlp.proj.weight INT8_MIN_CLIP_NAME_VALUE_OVERRIDES=.mlp.fc.weight:0.25 INT8_FP32_SCALE_AUDIT_NAME_PATTERNS=.mlp.fc.weight INT8_FP32_SCALE_AUDIT_LOG_TOPK=5 INT8_FP32_SCALE_AUDIT_MIN_GAIN=0.00005 INT8_FP32_SCALE_AUDIT_MIN_IMPROVED_TENSORS=4 INT8_FP32_SCALE_AUDIT_MIN_MEAN_GAIN=0.00002 INT8_FP32_SCALE_AUDIT_MIN_MEDIAN_GAIN=0.00001	This is one bounded audit-only change in `train_gpt.py`. It adds `INT8_FP32_SCALE_AUDIT_*` parsing and validation, scores only large 2D tensors that remain quantized after the current keep-float, auto-keep, fp32-scale, and min-clip decisions are fixed, uses the actual live-path min-clip setting for the baseline fp16-vs-fp32 comparison, and makes the evidence gate explicit before naming any winner. The audit logs candidate count, selected tensor, selected errors, exact extra scale bytes, the configured thresholds, the observed improved-count/mean/median, and a ranked candidate summary; if the family gate does not pass, it logs `selected:none` instead of implying a weak winner. | hypothesis=The kept `pgolf_0037` path already lowered the `.mlp.fc.weight` minimum stored-scale floor to `0.25`, which changes the live row-scale distribution for that family without changing their row-scale storage dtype. That makes fp16 row-scale rounding a more plausible remaining bottleneck for the nine still-quantized `.mlp.fc.weight` tensors than it was in the older broader fp32-scale audit. If replaying the exact current export path shows that fp32 row scales produce real normalized-MAE gains on several `.mlp.fc.weight` tensors at once, then the audit should surface a bounded winner; if the gains stay sparse or tiny, the audit should explicitly falsify the follow-up with `selected:none`. | expected_signals=Support: the run remains export-only and in-family with `pgolf_0037`; `Int8 auto-keep selector` still reports `candidates:19` and `selected:blocks.0.mlp.proj.weight`; `Int8 scale storage` still reports `fp32_tensors:8` and `fp32_bytes:16384`; `Int8 min-clip override` still reports `tensors:9 baseline:1.00000 overrides:.mlp.fc.weight:0.25000`; and the new `Int8 fp32-scale audit` reports `tensors:9` plus a non-`none` selected tensor only if the paired thresholds line also shows `selected_improved >= 4`, `selected_mean_gain >= 0.00002000`, `selected_median_gain >= 0.00001000`, and the selected tensor itself has `selected_gain >= 0.00005000`. Falsify: the audit matches fewer than 9 tensors, any live-path logs drift unexpectedly, or the thresholds line fails any of those gates so the audit cleanly logs `selected:none`, which would mean there is no trustworthy `.mlp.fc.weight` fp32-scale follow-up under the current `pgolf_0037` stack. | pre_review_round=2 | post_review=Revert: pgolf_0040 is a trustworthy audit-only run, but it does not justify keeping commit c65fbdeea6ed6a2621fc4a0c61e4b7247a08465d. The primary exact round-trip metric regressed versus the best prior kept result pgolf_0037, moving from val_bpb 1.58521499 to 1.58627619 and from val_loss 2.67656911 to 2.67836091, with size also slightly larger at 12226849 bytes versus 12221610 bytes.
41	2026-03-20T13:04:01+00:00	gpt-5.4	gpt-5.4	pgolf_0041	keep	1.58450676	2.67537328	12230961	6e5a81d6751d67706c9234011c14a256b3578cc0	Add an audit-only kept-float fp32 family check on top of the exact pgolf_0037 export stack, leaving the live serialized artifact unchanged while comparing current fp16 passthrough versus forced fp32 passthrough reconstruction error for the already-kept `c_v.weight` tensors.	INT8_KEEP_FLOAT_LARGE_NAME_PATTERNS=c_v.weight INT8_AUTO_KEEP_FLOAT_NAME_PATTERNS=tok_emb.weight,.attn.proj.weight,.mlp.proj.weight INT8_AUTO_KEEP_FLOAT_LOG_TOPK=5 INT8_FP32_SCALE_NAME_PATTERNS=.mlp.proj.weight INT8_MIN_CLIP_NAME_VALUE_OVERRIDES=.mlp.fc.weight:0.25 INT8_KEEP_FLOAT_FP32_AUDIT_NAME_PATTERNS=c_v.weight INT8_KEEP_FLOAT_FP32_AUDIT_LOG_TOPK=9 INT8_KEEP_FLOAT_FP32_AUDIT_MIN_TENSOR_GAIN=0.00005 INT8_KEEP_FLOAT_FP32_AUDIT_MIN_IMPROVED_TENSORS=6 INT8_KEEP_FLOAT_FP32_AUDIT_MIN_MEAN_GAIN=0.00005 INT8_KEEP_FLOAT_FP32_AUDIT_MIN_MEDIAN_GAIN=0.00005	This is one bounded serializer-only change in `train_gpt.py`. It factors the keep-float helper so an audit can force fp32 storage for named passthrough tensors without touching the live export path, computes fp16-versus-fp32 normalized-MAE deltas only for the matched family, logs exact extra raw bytes for promotion plus tensor-level summaries, and only names `fp32` actionable if explicit family-level gates clear on the current pgolf_0037 stack. | hypothesis=The current best stack in pgolf_0037 already keeps the nine `c_v.weight` tensors out of int8 quantization, but it still stores them through the default fp16 keep-float path. If a meaningful part of the remaining exact round-trip loss on that family comes from the fp16 storage cast itself, then an audit against the real current serializer state should show fp32 passthrough reducing normalized MAE versus fp16 on most of the nine tensors at once, with non-trivial positive mean and median gain across the family. If those gains are sparse or tiny, that falsifies spending a live round on fp32 promotion for `c_v.weight`. | expected_signals=Support: the live pgolf_0037 export logs stay unchanged in-family, including `Int8 auto-keep selector` still selecting `blocks.0.mlp.proj.weight`, `Int8 scale storage` still reporting `fp32_tensors:8` and `fp32_bytes:16384`, and `Int8 min-clip override` still reporting `tensors:9 baseline:1.00000 overrides:.mlp.fc.weight:0.25000`; the new `Int8 kept-float fp32 audit` log reports `tensors:9` and the exact total `extra_raw_bytes` for promoting those nine passthrough tensors from fp16 storage to fp32; `Int8 kept-float fp32 thresholds` reports at least `selected_improved:6`, `selected_mean_gain >= 0.00005000`, and `selected_median_gain >= 0.00005000`; and `Int8 kept-float fp32 candidates` lists all 9 matched tensors because `INT8_KEEP_FLOAT_FP32_AUDIT_LOG_TOPK=9`. Falsify: the audit matches fewer than 9 tensors, any of the existing pgolf_0037 live-path logs drift unexpectedly, the candidate summary does not report all 9 matched tensors, or the family summary stays below the improved-count / mean-gain / median-gain thresholds and therefore logs `selected:none`, which would mean there is no trustworthy family-wide case for live fp32 promotion of `c_v.weight`. | pre_review_round=2 | post_review=Keep: pgolf_0041 is trustworthy, improves the best prior kept exact round-trip result from val_bpb 1.58521499 / val_loss 2.67656911 to val_bpb 1.58450676 / val_loss 2.67537328, and also delivers a strong, clearly positive audit result for the nine kept c_v.weight tensors.
