iteration	timestamp	model	review_model	run_id	decision	val_bpb	val_loss	size_bytes	commit	idea	env	notes
42	2026-03-20T13:24:12+00:00	gpt-5.4	gpt-5.4	pgolf_0042	keep	1.58402850	2.67456578	14437856	71e6446edc75ffec6117d4b627efdd5b7833fd48	Add a live-only fp32 passthrough override for already-kept tensors, keep selector scoring on the established fp16 keep-float path, and test promoting only the existing `c_v.weight` passthrough family from fp16 storage to fp32 on top of the current best export stack.	INT8_KEEP_FLOAT_LARGE_NAME_PATTERNS=c_v.weight INT8_AUTO_KEEP_FLOAT_NAME_PATTERNS=tok_emb.weight,.attn.proj.weight,.mlp.proj.weight INT8_AUTO_KEEP_FLOAT_LOG_TOPK=5 INT8_FP32_SCALE_NAME_PATTERNS=.mlp.proj.weight INT8_MIN_CLIP_NAME_VALUE_OVERRIDES=.mlp.fc.weight:0.25 INT8_KEEP_FLOAT_FP32_EXTRA_NAME_PATTERNS=c_v.weight	This is one bounded serializer-only change in `train_gpt.py`. The patch adds `INT8_KEEP_FLOAT_FP32_EXTRA_NAME_PATTERNS`, applies it only on the live passthrough export path, keeps `score_keep_float_candidate` on the prior fp16 keep path so the current auto-keep choice remains causal, and logs exact tensor-count and raw-byte deltas for the extra fp32 promotion so pre-review can verify that only the intended already-kept family changed. | hypothesis=The kept pgolf_0041 audit on top of the current pgolf_0037 live export path showed clear family-wide benefit from storing the nine already-kept `c_v.weight` tensors in fp32 instead of fp16, with all 9 tensors improving and strong positive mean and median normalized-MAE gain. If that audit signal is causal rather than diagnostic, then a live-export-only `INT8_KEEP_FLOAT_FP32_EXTRA_NAME_PATTERNS=c_v.weight` path should remove the remaining fp16 storage-cast error on those nine passthrough tensors while leaving auto-keep scoring pinned to the old fp16 keep path, improving `final_int8_zlib_roundtrip_exact` versus the current best kept result at val_bpb 1.58450676 / val_loss 2.67537328. | expected_signals=Support: the run completes normally with export-only throughput still in-family with pgolf_0041; `Int8 auto-keep selector` still reports `candidates:19` and `selected:blocks.0.mlp.proj.weight`; `Int8 scale storage` still reports `fp32_tensors:8` and `fp32_bytes:16384`; `Int8 min-clip override` still reports `tensors:9 baseline:1.00000 overrides:.mlp.fc.weight:0.25000`; the new `Kept float storage` log reports `extra_fp32_tensors:9` and `extra_fp32_extra_bytes:2359296`, confirming that only the nine already-kept `c_v.weight` tensors were promoted from baseline fp16 passthrough to fp32 while selector scoring stayed on the old path; total submission size remains below 16000000 bytes; and final exact round-trip metrics improve below val_bpb 1.58450676 and val_loss 2.67537328. Falsify: the selector changes, the new kept-float log does not report exactly `extra_fp32_tensors:9` and `extra_fp32_extra_bytes:2359296`, the fp32-scale or min-clip logs drift unexpectedly, size breaches the cap, or final exact metrics stay flat or worsen versus the current best kept result. | pre_review_round=1 | post_review=Keep: pgolf_0042 looks trustworthy and improves the best prior kept exact round-trip result from val_bpb 1.58450676 / val_loss 2.67537328 to val_bpb 1.58402850 / val_loss 2.67456578 while remaining under the 16000000-byte cap at 14437856 bytes.
43	2026-03-20T14:00:10+00:00	gpt-5.4	gpt-5.4	pgolf_0043	revert	1.58458439	2.67550437	14449792	e9b6b5a81f5f8c9163d4f1bd3be202507ae6c32d	Add an audit-only current-path keep-float ranking for the large tensors that still quantize under the kept pgolf_0042 export stack, and only mark `.mlp.fc.weight` actionable when the best focused tensor clears explicit gain and global-rank gates.	INT8_KEEP_FLOAT_LARGE_NAME_PATTERNS=c_v.weight INT8_AUTO_KEEP_FLOAT_NAME_PATTERNS=tok_emb.weight,.attn.proj.weight,.mlp.proj.weight INT8_AUTO_KEEP_FLOAT_LOG_TOPK=5 INT8_FP32_SCALE_NAME_PATTERNS=.mlp.proj.weight INT8_MIN_CLIP_NAME_VALUE_OVERRIDES=.mlp.fc.weight:0.25 INT8_KEEP_FLOAT_FP32_EXTRA_NAME_PATTERNS=c_v.weight INT8_CURRENT_KEEP_FLOAT_AUDIT_NAME_PATTERNS=.mlp.fc.weight INT8_CURRENT_KEEP_FLOAT_AUDIT_LOG_TOPK=9 INT8_CURRENT_KEEP_FLOAT_AUDIT_MIN_TENSOR_GAIN=0.00005 INT8_CURRENT_KEEP_FLOAT_AUDIT_MIN_IMPROVED_TENSORS=4 INT8_CURRENT_KEEP_FLOAT_AUDIT_MIN_MEAN_GAIN=0.00002 INT8_CURRENT_KEEP_FLOAT_AUDIT_MAX_GLOBAL_RANK=3	This is one bounded audit-only serializer change in `train_gpt.py`. It adds current-path keep-float scoring for still-quantized large tensors using the exact live export settings, excludes tensors already kept by the current stack, logs a global ranking plus a focused `.mlp.fc.weight` summary, and leaves the serialized artifact format, training math, optimizer behavior, selector behavior, and live export path unchanged. | hypothesis=After pgolf_0042, the live export path already keeps `c_v.weight` in float32, auto-keeps one `blocks.0.mlp.proj.weight`, stores fp32 row scales for the remaining quantized `.mlp.proj.weight` tensors, and applies the `.mlp.fc.weight:0.25` live min-clip override. If a real single-tensor keep-float follow-up for `.mlp.fc.weight` still exists under that actual stack, then replaying the current live quantization path should show at least one focused `.mlp.fc.weight` tensor with a non-trivial keep-float gain and a strong global rank among all still-quantized large tensors; otherwise the audit should explicitly reject the follow-up with `selected:none`. | expected_signals=Support: the run stays export-only and in-family with pgolf_0042; `Int8 auto-keep selector` still reports `candidates:19` and `selected:blocks.0.mlp.proj.weight`; `Int8 scale storage` still reports `fp32_tensors:8` and `fp32_bytes:16384`; `Int8 min-clip override` still reports `tensors:9 baseline:1.00000 overrides:.mlp.fc.weight:0.25000`; `Kept float storage` still reports `extra_fp32_tensors:9` and `extra_fp32_extra_bytes:2359296`; the new `Int8 current-path keep audit` log reports `candidates:27`, `focused_tensors:9`, and either a concrete `.mlp.fc.weight` `selected` name with `selected_rank <= 3` or `selected:none`; `Int8 current-path keep thresholds` reports `focused_improved >= 4`, `focused_mean_gain >= 0.00002000`, and `focused_best_gain >= 0.00005000` only when a focused winner is named; `Int8 current-path keep global top` and `Int8 current-path keep focused` show where `.mlp.fc.weight` sits relative to the existing frontier families. Falsify: candidate or focused counts drift from 27 and 9, the existing live-path logs change unexpectedly, or the audit logs `selected:none` with the focused family failing the configured gain/rank gates, which would mean `.mlp.fc.weight` is not a trustworthy next keep-float target under the actual pgolf_0042 stack. | pre_review_round=1 | post_review=Revert: pgolf_0043 is an internally consistent, trustworthy audit-only run, but it regresses the best prior kept exact round-trip result from val_bpb 1.58402850 / val_loss 2.67456578 to val_bpb 1.58458439 / val_loss 2.67550437 at a slightly larger 14449792-byte submission, so it does not clear the bar for retention.
44	2026-03-20T15:42:26+00:00	gpt-5.4	gpt-5.4	pgolf_0044	revert	1.58465263	2.67561959	14444955	37c2c62853a91d2db41bc7d9c0aa4835b309a37e	Add an audit-only current-path fp16->fp32 promotion check for the actual auto-kept tensor on top of the kept pgolf_0042 export stack, and measure exact feasibility in final submission-byte units by recompressing the promoted artifact instead of comparing mixed raw-payload heuristics.	INT8_KEEP_FLOAT_LARGE_NAME_PATTERNS=c_v.weight INT8_AUTO_KEEP_FLOAT_NAME_PATTERNS=tok_emb.weight,.attn.proj.weight,.mlp.proj.weight INT8_AUTO_KEEP_FLOAT_LOG_TOPK=5 INT8_FP32_SCALE_NAME_PATTERNS=.mlp.proj.weight INT8_MIN_CLIP_NAME_VALUE_OVERRIDES=.mlp.fc.weight:0.25 INT8_KEEP_FLOAT_FP32_EXTRA_NAME_PATTERNS=c_v.weight INT8_AUTO_KEEP_SELECTED_FP32_AUDIT=1 INT8_AUTO_KEEP_SELECTED_FP32_AUDIT_MIN_GAIN=0.00005	This is one bounded audit-only change in `train_gpt.py`. It does not alter the live serialized artifact, quantization path, dequantization path, training math, selector scoring rule, or evaluation behavior. The patch only adds an opt-in audit that inspects the actual auto-kept passthrough tensor after the current exporter has chosen it, reconstructs fp16-versus-fp32 storage error for that same tensor, and recompresses a promoted copy of the artifact to report exact final submission-byte deltas in the same units as the cap. This intentionally avoids the mixed-family heuristic ranking that pre-review flagged and restricts the audit to a true fp16->fp32 promotion of a tensor that is already on the keep-float path. | hypothesis=After pgolf_0042, the live export path already promotes the nine kept c_v.weight tensors to fp32, so the clean remaining fp16->fp32 promotion question is the single extra auto-kept tensor, which the current stack stores through the fp16 keep-float path. If a meaningful part of the remaining exact round-trip loss comes from that final storage cast on the selected auto-kept tensor rather than from the still-quantized families, then replaying the exact current serializer state and promoting only that one selected passthrough tensor from fp16 storage to fp32 should show a positive normalized-MAE gain while the recompressed promoted artifact still fits under the 16000000-byte cap. If the gain is negligible or the exact promoted artifact breaches the cap, that falsifies a live fp32 follow-up for the selected tensor. | expected_signals=Support: the run stays export-only and in-family with pgolf_0042, including `Int8 auto-keep selector` still reporting `candidates:19` and `selected:blocks.0.mlp.proj.weight`, `Int8 scale storage` still reporting `fp32_tensors:8` and `fp32_bytes:16384`, `Int8 min-clip override` still reporting `tensors:9 baseline:1.00000 overrides:.mlp.fc.weight:0.25000`, and `Kept float storage` still reporting `extra_fp32_tensors:9` and `extra_fp32_extra_bytes:2359296`. The new `Int8 auto-keep selected fp32 audit` log should report the same selected tensor with `baseline_store_dtype:float16`, `promoted_store_dtype:float32`, and positive `gain` at or above `0.00005000`. The paired `Int8 auto-keep selected fp32 bytes` log should report exact `baseline_submission` and `promoted_submission` totals, with `extra_submission` measured from the recompressed promoted artifact and `remaining_after` still non-negative. Falsify: there is no selected auto-kept tensor, the selected tensor is already not on the fp16 keep-float path, the new audit reports non-positive or sub-threshold gain, or the exact recompressed `promoted_submission` exceeds the size cap so `remaining_after` is negative. | pre_review_round=3 | post_review=Revert: pgolf_0044 is a trustworthy audit-only run, but it regresses the best prior kept exact round-trip result from val_bpb 1.58402850 / val_loss 2.67456578 to val_bpb 1.58465263 / val_loss 2.67561959 at a slightly larger 14444955-byte submission, so it does not clear the bar for retention.
45	2026-03-20T15:57:28+00:00	gpt-5.4	gpt-5.4	pgolf_0045	revert	1.58698388	2.67955581	14441300	0994e0f65e02f21437fc9262dfbeff6d60b434c5	Add an audit-only current-path keep-float family ranking on top of the kept pgolf_0042 export stack, and only mark `.attn.proj.weight` actionable when the best focused tensor clears explicit gain and global-rank gates under the actual current serializer path.	INT8_KEEP_FLOAT_LARGE_NAME_PATTERNS=c_v.weight INT8_AUTO_KEEP_FLOAT_NAME_PATTERNS=tok_emb.weight,.attn.proj.weight,.mlp.proj.weight INT8_AUTO_KEEP_FLOAT_LOG_TOPK=5 INT8_FP32_SCALE_NAME_PATTERNS=.mlp.proj.weight INT8_MIN_CLIP_NAME_VALUE_OVERRIDES=.mlp.fc.weight:0.25 INT8_KEEP_FLOAT_FP32_EXTRA_NAME_PATTERNS=c_v.weight INT8_CURRENT_KEEP_FLOAT_AUDIT_NAME_PATTERNS=.attn.proj.weight INT8_CURRENT_KEEP_FLOAT_AUDIT_LOG_TOPK=9 INT8_CURRENT_KEEP_FLOAT_AUDIT_MIN_TENSOR_GAIN=0.00005 INT8_CURRENT_KEEP_FLOAT_AUDIT_MIN_IMPROVED_TENSORS=4 INT8_CURRENT_KEEP_FLOAT_AUDIT_MIN_MEAN_GAIN=0.00002 INT8_CURRENT_KEEP_FLOAT_AUDIT_MAX_GLOBAL_RANK=3	This is one bounded audit-only serializer change in `train_gpt.py`. It adds current-path keep-float scoring for still-quantized large tensors using the exact live export settings, excludes tensors already kept by the current stack, logs a global ranking plus a focused `.attn.proj.weight` summary, and leaves the serialized artifact format, training math, optimizer behavior, selector behavior, and live export path unchanged. | hypothesis=Before `.mlp.proj.weight` became the frontier, the single-tensor auto-keep selector in pgolf_0009 chose `blocks.0.attn.proj.weight`, which suggests the attention output projections were a real residual error source rather than noise. After pgolf_0042, the live path already keeps `c_v.weight` in fp32, auto-keeps one `.mlp.proj.weight`, stores fp32 row scales for the remaining quantized `.mlp.proj.weight` tensors, and applies the `.mlp.fc.weight:0.25` min-clip override. If a meaningful one-more-tensor keep-float opportunity still remains in the nine `.attn.proj.weight` tensors under that exact current stack, then replaying the current quantization path should show at least one focused `.attn.proj.weight` tensor with non-trivial keep-float gain and a competitive global rank among all remaining large quantized tensors. If the family no longer ranks competitively, this audit should explicitly reject it with `selected:none`. | expected_signals=Support: the run stays export-only and in-family with pgolf_0042; `Int8 auto-keep selector` still reports `candidates:19` and `selected:blocks.0.mlp.proj.weight`; `Int8 scale storage` still reports `fp32_tensors:8` and `fp32_bytes:16384`; `Int8 min-clip override` still reports `tensors:9 baseline:1.00000 overrides:.mlp.fc.weight:0.25000`; `Kept float storage` still reports `extra_fp32_tensors:9` and `extra_fp32_extra_bytes:2359296`; the new `Int8 current-path keep audit` log reports `candidates:45`, `focused_tensors:9`, and either a concrete `.attn.proj.weight` `selected` name with `selected_rank <= 3` or `selected:none`; `Int8 current-path keep thresholds` reports `focused_improved >= 4`, `focused_mean_gain >= 0.00002000`, and `focused_best_gain >= 0.00005000` only when a focused winner is named; `Int8 current-path keep global top` and `Int8 current-path keep focused` show where `.attn.proj.weight` sits relative to the remaining large quantized field. Falsify: candidate or focused counts drift from 45 and 9, the existing live-path logs change unexpectedly, or the audit logs `selected:none` with the focused family failing the configured gain/rank gates, which would mean `.attn.proj.weight` is not a trustworthy next keep-float target under the actual pgolf_0042 stack. | pre_review_round=1 | post_review=Revert: pgolf_0045 is a trustworthy audit-only run, but it regresses the best prior kept exact round-trip result from val_bpb 1.58402850 / val_loss 2.67456578 to val_bpb 1.58698388 / val_loss 2.67955581 at a slightly larger 14441300-byte submission, so it does not clear the bar for retention.
46	2026-03-20T16:12:31+00:00	gpt-5.4	gpt-5.4	pgolf_0046	revert	1.58509943	2.67637399	15410687	cff1b7e8010bd5f91019f82b926aae9ba2b062f4	Add a live-only fp32 storage override for the single auto-kept tensor, while keeping the current auto-keep selector scoring on its established fp16 keep-float path.	INT8_KEEP_FLOAT_LARGE_NAME_PATTERNS=c_v.weight INT8_AUTO_KEEP_FLOAT_NAME_PATTERNS=tok_emb.weight,.attn.proj.weight,.mlp.proj.weight INT8_AUTO_KEEP_FLOAT_LOG_TOPK=5 INT8_FP32_SCALE_NAME_PATTERNS=.mlp.proj.weight INT8_MIN_CLIP_NAME_VALUE_OVERRIDES=.mlp.fc.weight:0.25 INT8_KEEP_FLOAT_FP32_EXTRA_NAME_PATTERNS=c_v.weight INT8_AUTO_KEEP_FLOAT_SELECTED_FP32=1	This is one bounded serializer-only change in train_gpt.py. It adds `INT8_AUTO_KEEP_FLOAT_SELECTED_FP32`, applies that promotion only on the live passthrough export path for the already-selected auto-keep tensor, keeps selector scoring on the prior fp16 keep path so the current selected tensor remains causal, and logs exact tensor-count and byte deltas for the selected-tensor fp32 promotion so pre-review can verify that only one extra tensor changed storage. | hypothesis=The current best kept stack in pgolf_0042 already promotes the nine kept c_v.weight tensors to fp32, but the selector-chosen extra tensor is still stored through the default fp16 keep-float path. pgolf_0044's exact current-path audit reported the same selected tensor `blocks.0.mlp.proj.weight`, a positive fp16->fp32 normalized-MAE gain of 0.00017628, and a recompressed promoted submission that still fit under the 16000000-byte cap. If that audit signal is causal, then promoting only the selected auto-kept tensor to fp32 on the live export path should remove the remaining fp16 storage-cast error on that high-leverage tensor and improve final_int8_zlib_roundtrip_exact versus pgolf_0042 without changing training behavior or selector causality. | expected_signals=Support: the run completes normally with export-only throughput still in-family with pgolf_0042; `Int8 auto-keep selector` still reports `candidates:19` and `selected:blocks.0.mlp.proj.weight`; `Int8 scale storage` still reports `fp32_tensors:8` and `fp32_bytes:16384`; `Int8 min-clip override` still reports `tensors:9 baseline:1.00000 overrides:.mlp.fc.weight:0.25000`; `Kept float storage` still reports `extra_fp32_tensors:9` and `extra_fp32_extra_bytes:2359296` for `c_v.weight`; the new `Int8 auto-keep selected fp32` log reports `selected:blocks.0.mlp.proj.weight`, `selected_fp32_tensors:1`, and `selected_fp32_extra_bytes:1048576`; total submission size remains below 16000000 bytes; and final exact round-trip metrics improve below val_bpb 1.58402850 and val_loss 2.67456578. Falsify: the selector changes, the new selected-fp32 log does not report exactly one promoted selected tensor with 1048576 extra raw bytes, the existing fp32-scale/min-clip/c_v logs drift unexpectedly, size breaches the cap, or final exact metrics stay flat or worsen versus pgolf_0042. | pre_review_round=1 | post_review=Revert: pgolf_0046 is internally consistent and the new fp32-selected-auto-keep path fired exactly as intended, but the live change regresses the best prior kept result from pgolf_0042 on both exact round-trip metrics while using substantially more of the size budget, so it is not a real improvement worth keeping.
47	2026-03-20T16:29:35+00:00	gpt-5.4	gpt-5.4	pgolf_0047	revert	1.58435778	2.67512175	15424546	8f788572da609d49d52980ae09e2f7979ad63e8c	Add a live-only fp32 storage override for the single auto-kept tensor, while keeping the current auto-keep selector scoring on its established fp16 keep-float path.	INT8_KEEP_FLOAT_LARGE_NAME_PATTERNS=c_v.weight INT8_AUTO_KEEP_FLOAT_NAME_PATTERNS=tok_emb.weight,.attn.proj.weight,.mlp.proj.weight INT8_AUTO_KEEP_FLOAT_LOG_TOPK=5 INT8_FP32_SCALE_NAME_PATTERNS=.mlp.proj.weight INT8_MIN_CLIP_NAME_VALUE_OVERRIDES=.mlp.fc.weight:0.25 INT8_KEEP_FLOAT_FP32_EXTRA_NAME_PATTERNS=c_v.weight INT8_AUTO_KEEP_SELECTED_FP32=1	This is one bounded serializer-only change in `train_gpt.py`. It adds `INT8_AUTO_KEEP_SELECTED_FP32`, keeps `score_keep_float_candidate` on the baseline fp16 keep path, applies the fp32 promotion only after the auto-kept tensor has already been selected, and extends the existing `Kept float storage` log with `selected_fp32_tensors`, `selected_fp32_extra_bytes`, and the selected tensor name so the live run can be audited directly against pgolf_0042 and the pgolf_0044 feasibility audit. | hypothesis=The reverted pgolf_0044 audit on top of the kept pgolf_0042 stack showed that the actual selected auto-kept tensor, `blocks.0.mlp.proj.weight`, has positive fp16->fp32 storage gain and still leaves exact submission-byte headroom. If that audit signal is causal, then promoting only that already-selected passthrough tensor to fp32 in the live export path should remove the remaining fp16 storage-cast error on the selected keep tensor while leaving the selector itself pinned to the same baseline fp16 keep path, improving `final_int8_zlib_roundtrip_exact` versus pgolf_0042's val_bpb 1.58402850 / val_loss 2.67456578. | expected_signals=Support: the run stays export-only and in-family with pgolf_0042; `Int8 auto-keep selector` still reports `candidates:19` and `selected:blocks.0.mlp.proj.weight`; `Int8 scale storage` still reports `fp32_tensors:8` and `fp32_bytes:16384`; `Int8 min-clip override` still reports `tensors:9 baseline:1.00000 overrides:.mlp.fc.weight:0.25000`; `Kept float storage` still reports `extra_fp32_tensors:9` and `extra_fp32_extra_bytes:2359296` for `c_v.weight`, and now also reports `selected_fp32_tensors:1`, `selected_fp32_extra_bytes:523264`, and `selected_name:blocks.0.mlp.proj.weight`; total submission size remains below 16000000 bytes; and final exact round-trip metrics improve below val_bpb 1.58402850 and val_loss 2.67456578. Falsify: the selector changes, the new kept-float log does not report exactly `selected_fp32_tensors:1`, `selected_fp32_extra_bytes:523264`, and `selected_name:blocks.0.mlp.proj.weight`, the existing pgolf_0042 export-path logs drift unexpectedly, size breaches the cap, or final exact metrics stay flat or worsen versus pgolf_0042. | pre_review_round=3 | post_review=Revert: pgolf_0047 is internally consistent and the selected-auto-keep fp32 promotion fired, but it regresses the best prior kept exact round-trip result from pgolf_0042 while consuming substantially more size budget, so it is not a real improvement worth keeping.
