iteration	timestamp	model	review_model	run_id	decision	val_bpb	val_loss	size_bytes	commit	idea	env	notes
17	2026-03-20T04:24:15+00:00	gpt-5.4	gpt-5.4	pgolf_0017	error				c8f34cd6520bcbe03e95e4f8387eff448af42eec	Add an opt-in tensor-name clip-percentile override for int8 export, keep the single-tensor auto-keep selector on its current baseline scoring path, and test a slightly higher clip percentile only on the still-quantized `.mlp.proj.weight` tensors on top of the kept pgolf_0014 export setup.	INT8_KEEP_FLOAT_LARGE_NAME_PATTERNS=c_v.weight INT8_AUTO_KEEP_FLOAT_NAME_PATTERNS=tok_emb.weight,.attn.proj.weight,.mlp.proj.weight INT8_AUTO_KEEP_FLOAT_LOG_TOPK=5 INT8_FP32_SCALE_NAME_PATTERNS=.mlp.proj.weight INT8_CLIP_PERCENTILE_OVERRIDES=.mlp.proj.weight:99.99992	This is one bounded serializer-only change in `train_gpt.py`. It adds `INT8_CLIP_PERCENTILE_OVERRIDES` as a name-pattern-to-percentile map, threads the chosen quantile through int8 quantization, keeps auto-keep candidate scoring pinned to the existing baseline clip and fp16-scale path so selector behavior remains causal, and logs the exact count of quantized tensors that used an override so the run can be audited directly from the remote log. | stage=experiment | error=missing final metric line in /root/parameter-golf/remote_logs/pgolf_0017.log | hypothesis=pgolf_0014 showed that the remaining highest-leverage still-quantized family is `.mlp.proj.weight`: the selector still chose `blocks.0.mlp.proj.weight`, and storing fp32 row scales for the other eight quantized MLP projections produced a clear gain. That suggests some residual exact round-trip error may still come from clipping a few large residual-writeback coefficients in those same quantized tensors, not just from scale rounding. If only the still-quantized `.mlp.proj.weight` tensors use a slightly higher int8 clipping percentile during actual export, while selector scoring stays fixed on the existing baseline path, then the exporter should preserve more of those rare large coefficients without changing training or the chosen auto-kept tensor, improving `final_int8_zlib_roundtrip_exact` versus pgolf_0014. | expected_signals=Support: the run completes normally with export-only throughput still in-family with pgolf_0014; `Int8 auto-keep selector` still reports `candidates:19` and `selected:blocks.0.mlp.proj.weight`; `Int8 scale storage` still reports `fp32_tensors:8` and `fp32_bytes:16384`; the new `Int8 clip overrides` log reports `tensors:8`, confirming that only the eight still-quantized `.mlp.proj.weight` tensors used the override while the selected ninth tensor stayed on the keep-float path; submission size stays close to pgolf_0014; and final exact round-trip metrics improve below val_bpb 1.58718007 and val_loss 2.67988706. Falsify: the selector changes, the new clip-override log does not report exactly `tensors:8`, the fp32-scale audit changes unexpectedly, size shifts materially, or final exact metrics stay flat or worsen versus pgolf_0014. | pre_review_round=1
18	2026-03-20T05:00:00+00:00	gpt-5.4	gpt-5.4	pgolf_0018	revert	1.58941456	2.68365991	11306321	6fb6c590f9fed1123df44b1a90156aefeef2cd20	Replace the int8 auto-keep selector's standalone per-tensor proxy with a full-export-state scorer, then rerun the kept pgolf_0014 export setup so candidate ranking reflects the real current serializer path.	INT8_KEEP_FLOAT_LARGE_NAME_PATTERNS=c_v.weight INT8_AUTO_KEEP_FLOAT_NAME_PATTERNS=tok_emb.weight,.attn.proj.weight,.mlp.proj.weight INT8_AUTO_KEEP_FLOAT_LOG_TOPK=5 INT8_FP32_SCALE_NAME_PATTERNS=.mlp.proj.weight	This is one bounded serializer-only change in `train_gpt.py`. The patch replaces the auto-keep selector's old standalone tensor scorer with a full-export-state scorer that simulates the actual current serializer configuration for each candidate, including the existing `c_v.weight` passthrough and `.mlp.proj.weight` fp32-scale override on only the remaining still-quantized tensors. It also logs scorer mode, baseline-vs-selected full-state error, and fp32-scale audit counts so pre-review can verify that the selected winner came from the full-state scorer rather than the older per-tensor proxy. | hypothesis=pgolf_0014 is the current best kept frontier at val_bpb 1.58718007 / val_loss 2.67988706, but its selector still ranks candidates from a standalone baseline quantization proxy instead of the actual export state that already keeps `c_v.weight` in float and stores fp32 row scales on the still-quantized `.mlp.proj.weight` tensors. If that proxy is mis-ranking the one extra tensor to rescue, then scoring each candidate by simulating the full current export state should change the selected tensor away from `blocks.0.mlp.proj.weight` and improve `final_int8_zlib_roundtrip_exact` without changing training behavior or the one-tensor payload budget. | expected_signals=Support: the run completes normally with export-only throughput still in-family with pgolf_0014; `Int8 auto-keep selector` logs `scorer:full_export_state_v1`; `Int8 auto-keep full-state audit` shows the baseline state with `baseline_fp32_tensors:9` and the chosen state's fp32-scale count consistent with the selected family; the top-candidate summary and final selector output choose a different tensor than pgolf_0014's `blocks.0.mlp.proj.weight`; and final exact round-trip metrics improve below val_bpb 1.58718007 and val_loss 2.67988706. Falsify: the selector still chooses `blocks.0.mlp.proj.weight`, the new full-state audit logs are missing or inconsistent with the current serializer path, or final exact metrics stay flat or worsen versus pgolf_0014. | pre_review_round=2 | post_review=Revert: pgolf_0018 executed the approved full-export-state selector audit cleanly, but it did not improve on the best prior kept result and it falsified the intended mechanism by selecting the same auto-kept tensor as pgolf_0014.
19	2026-03-20T05:19:39+00:00	gpt-5.4	gpt-5.4	pgolf_0019	revert	1.59063018	2.68571243	11299055	92308c83c8f2b8cf9cacdf7eb87a3adcdd1f7105	Add an opt-in grouped per-row int8 quantization path for named 2D tensors, keep the existing single-tensor auto-keep selector on its baseline fp16 per-row scoring path, and test grouped scales only on the still-quantized `.mlp.proj.weight` tensors on top of the kept `c_v.weight` passthrough plus the current `tok_emb.weight,.attn.proj.weight,.mlp.proj.weight` candidate family.	INT8_KEEP_FLOAT_LARGE_NAME_PATTERNS=c_v.weight INT8_AUTO_KEEP_FLOAT_NAME_PATTERNS=tok_emb.weight,.attn.proj.weight,.mlp.proj.weight INT8_AUTO_KEEP_FLOAT_LOG_TOPK=5 INT8_FP32_SCALE_NAME_PATTERNS=.mlp.proj.weight INT8_GROUPED_SCALE_NAME_PATTERNS=.mlp.proj.weight INT8_GROUPED_SCALE_GROUP_SIZE=128	This is one bounded serializer-only change in `train_gpt.py`. It adds grouped per-row scale storage for matched 2D tensors in the live export path, extends dequantization to restore those grouped-scale tensors, and adds audit fields that make the selector/export separation checkable in logs on the current base: the selector reports its baseline fp16 per-row path and the count of grouped-scale candidate matches it excluded, while the export reports the tensors and scale payload that actually used grouped scales under `full_export_state_v1`. No training math, optimizer behavior, data order, or selector objective is changed. | hypothesis=pgolf_0014 is the current best kept export path because it already preserves `c_v.weight` in float, auto-keeps one `.mlp.proj.weight`, and stores fp32 per-row scales for the other eight quantized MLP projections. That still leaves each quantized MLP projection row sharing one scale across all 1024 input columns. If a meaningful part of the remaining exact round-trip loss comes from within-row range variation inside those still-quantized `.mlp.proj.weight` tensors, then giving only the current `full_export_state_v1` export path finer-grained per-row group scales should reduce quantization error enough to improve `final_int8_zlib_roundtrip_exact` versus pgolf_0014, while the selector remains causal because its scoring path stays on the baseline fp16 per-row proxy and explicitly excludes grouped scales. | expected_signals=Support: the run completes normally with export-only throughput still in-family with pgolf_0014; `Int8 auto-keep selector` logs `selector_path:baseline_fp16_per_row_v1`, `export_path:full_export_state_v1`, `grouped_scale_scoring:excluded`, and `grouped_scale_candidate_matches:9`, showing that grouped scales were visible to the current export path but not to selector scoring; the selector still chooses `blocks.0.mlp.proj.weight`; `Int8 grouped scale export` logs `tensors:8`, `scale_values:65536`, `scale_bytes:262144`, and `group_size:128`, confirming that only the eight still-quantized `.mlp.proj.weight` tensors used grouped fp32 scales after one family member was auto-kept; `Int8 scale storage` remains internally consistent with those grouped tensors being counted as fp32 scale tensors; submission size rises modestly but stays well under the 16000000-byte cap; and final exact round-trip metrics improve below pgolf_0014 at val_bpb 1.58718007 and val_loss 2.67988706. Falsify: the selector log does not show the explicit baseline-vs-full-export separation, the selected tensor changes despite unchanged selector scoring, the grouped export log does not report exactly 8 tensors / 65536 scale values / 262144 scale bytes, size grows materially beyond the expected grouped-scale overhead, or final exact metrics stay flat or worsen versus pgolf_0014. | pre_review_round=2 | post_review=Revert: pgolf_0019 does not improve on the best prior kept result, and one of the pre-review audit expectations for grouped-scale export did not match the observed log. The run completed cleanly and looks mechanically comparable to prior export-only runs, but final_int8_zlib_roundtrip_exact regressed from val_bpb 1.58718007 / val_loss 2.67988706 in pgolf_0014 to val_bpb 1.59063018 / val_loss 2.68571243 here, so this is not a worthwhile retained change.
20	2026-03-20T06:12:29+00:00	gpt-5.4	gpt-5.4	pgolf_0020	error				7472a6e90f2dae4e8b4917f53b2bcd9a2c9789c3	Add an additive fp32 keep-float override env for named passthrough tensors plus exact audit logging, then test storing the already-kept `c_v.weight` tensors in fp32 on top of the kept pgolf_0014 export setup.	INT8_KEEP_FLOAT_LARGE_NAME_PATTERNS=c_v.weight INT8_KEEP_FLOAT_FP32_EXTRA_NAME_PATTERNS=c_v.weight INT8_AUTO_KEEP_FLOAT_NAME_PATTERNS=tok_emb.weight,.attn.proj.weight,.mlp.proj.weight INT8_AUTO_KEEP_FLOAT_LOG_TOPK=5 INT8_FP32_SCALE_NAME_PATTERNS=.mlp.proj.weight	This is one bounded serializer-only change in `train_gpt.py`. It adds `INT8_KEEP_FLOAT_FP32_EXTRA_NAME_PATTERNS` as an additive env-controlled match set on top of the existing default fp32 keep-float patterns, counts only those extra matched tensors in new audit stats, and logs exact override tensor/byte totals so the c_v fp32 passthrough ablation can be reviewed as a trustworthy export-only comparison. | stage=experiment | error=missing final metric line in /root/parameter-golf/remote_logs/pgolf_0020.log | hypothesis=pgolf_0014 is the current best kept frontier with `c_v.weight` already preserved as kept-float tensors, one `.mlp.proj.weight` tensor auto-kept, and the remaining quantized `.mlp.proj.weight` tensors using fp32 row scales. The value-projection family was the first major export win, so part of the remaining exact round-trip loss may still come from the final fp16 storage cast applied to those nine kept `c_v.weight` tensors. If the exporter can additively promote only that already-kept family to fp32 storage without disturbing the existing selector or `.mlp.proj.weight` scale override, then `final_int8_zlib_roundtrip_exact` should improve versus pgolf_0014 while staying under the 16000000-byte cap. | expected_signals=Support: the run completes normally with export-only throughput still in-family with pgolf_0014; `Int8 auto-keep selector` still reports `selected:blocks.0.mlp.proj.weight`; `Int8 scale storage` still reports `fp32_tensors:8` and `fp32_bytes:16384`; the new `Kept float fp32 overrides` log reports exactly `tensors:9` and `bytes:4718592`, confirming that only the nine kept `c_v.weight` tensors were upgraded to fp32 storage; total submission size stays below 16000000 bytes; and final exact round-trip metrics improve below val_bpb 1.58718007 and val_loss 2.67988706. Falsify: the selector changes, the fp32-scale audit changes unexpectedly, the new override log does not show exactly 9 tensors and 4718592 bytes, size exceeds the cap, or final exact metrics stay flat or worsen versus pgolf_0014. | pre_review_round=1
21	2026-03-20T06:18:08+00:00	gpt-5.4	gpt-5.4	pgolf_0021	error				62ddf5b63518d3dbb0424f340a1a34498d535574	Add an opt-in per-row mean sidecar for named 2D int8-exported tensors, keep the existing single-tensor auto-keep selector on its baseline scoring path, and test row-mean restoration only on the still-quantized `.mlp.proj.weight` tensors on top of the kept pgolf_0014 export setup.	INT8_KEEP_FLOAT_LARGE_NAME_PATTERNS=c_v.weight INT8_AUTO_KEEP_FLOAT_NAME_PATTERNS=tok_emb.weight,.attn.proj.weight,.mlp.proj.weight INT8_AUTO_KEEP_FLOAT_LOG_TOPK=5 INT8_FP32_SCALE_NAME_PATTERNS=.mlp.proj.weight INT8_ROW_MEAN_NAME_PATTERNS=.mlp.proj.weight	This is one bounded serializer-only change in `train_gpt.py`. It adds `INT8_ROW_MEAN_NAME_PATTERNS`, stores an fp16 per-row mean sidecar for matched 2D tensors in the live export path, restores those offsets during dequantization, and logs aggregate row-mean tensor/value/byte counts so pre-review can audit the path directly from the remote log. The auto-keep selector and its baseline fp16-scale scoring path are unchanged, so any gain should come from the new row-mean restoration on the still-quantized tensors rather than from a different selected tensor. | stage=experiment | error=missing final metric line in /root/parameter-golf/remote_logs/pgolf_0021.log | hypothesis=pgolf_0014 is the current best kept export path because it keeps `c_v.weight` in float, auto-keeps one `.mlp.proj.weight`, and stores fp32 per-row scales for the other eight quantized MLP projection matrices. If part of the remaining exact round-trip loss in those still-quantized tensors comes from non-zero per-row offsets rather than only from scale rounding, then subtracting each row mean before symmetric int8 quantization and restoring that mean at load time should reduce residual quantization error at very small byte cost and improve `final_int8_zlib_roundtrip_exact` versus pgolf_0014's val_bpb 1.58718007 / val_loss 2.67988706 without changing training behavior. | expected_signals=Support: the run completes normally with export-only throughput still in-family with pgolf_0014; `Int8 auto-keep selector` still reports `candidates:19` and `selected:blocks.0.mlp.proj.weight`; `Int8 scale storage` still reports `fp32_tensors:8` and `fp32_bytes:16384`; the new `Int8 row mean export` log reports `tensors:8`, `values:4096`, and `bytes:8192`, confirming that only the eight still-quantized `.mlp.proj.weight` tensors stored fp16 row means after one family member was auto-kept; submission size rises only slightly versus pgolf_0014; and final exact round-trip metrics improve below val_bpb 1.58718007 and val_loss 2.67988706. Falsify: the selector changes unexpectedly, the new row-mean audit does not show exactly `tensors:8` / `values:4096` / `bytes:8192`, size grows materially beyond the expected small sidecar overhead, or final exact metrics stay flat or worsen versus pgolf_0014. | pre_review_round=1
22	2026-03-20T07:14:18+00:00	gpt-5.4	gpt-5.4	pgolf_0022	revert	1.59204519	2.68810161	11307572	4153b2715c2e574525a14178a25b10edcbf93e6b	Add an opt-in guarded row-mean sidecar format for named 2D int8-exported tensors, keep the current pgolf_0014 auto-keep selector and `.mlp.proj.weight` fp32-scale path unchanged, and test row-mean restoration only on the still-quantized `.mlp.proj.weight` tensors.	INT8_KEEP_FLOAT_LARGE_NAME_PATTERNS=c_v.weight INT8_AUTO_KEEP_FLOAT_NAME_PATTERNS=tok_emb.weight,.attn.proj.weight,.mlp.proj.weight INT8_AUTO_KEEP_FLOAT_LOG_TOPK=5 INT8_FP32_SCALE_NAME_PATTERNS=.mlp.proj.weight INT8_ROW_MEAN_NAME_PATTERNS=.mlp.proj.weight	This is one bounded serializer-only change in `train_gpt.py`. It adds `INT8_ROW_MEAN_NAME_PATTERNS`, stores matched per-row means in fp16, and restores them during dequantization. To preserve cross-loader trustworthiness without editing other readers, the row-mean path no longer reuses the plain v1 container shape: matched tensors store a guarded scale-entry dict containing both `scale` and `row_mean`, and the top-level `__quant_format__` switches to `int8_row_mean_guarded_v2` only when that path is used. That keeps old `int8_clean_per_row_v1` exports unchanged while making legacy readers fail fast rather than silently ignore the sidecar. | hypothesis=pgolf_0014 is the current best kept export path because it keeps `c_v.weight` in float, auto-keeps one `.mlp.proj.weight`, and stores fp32 per-row scales for the other eight quantized MLP projection matrices. If part of the remaining exact round-trip loss in those still-quantized tensors comes from non-zero per-row offsets rather than only from scale rounding, then subtracting each row mean before symmetric int8 quantization and restoring that mean at load time should reduce residual quantization error at very small byte cost and improve `final_int8_zlib_roundtrip_exact` versus pgolf_0014. This round makes the format change explicit and fail-fast: default exports stay on `int8_clean_per_row_v1`, while row-mean exports switch to a guarded `int8_row_mean_guarded_v2` representation that the updated `train_gpt.py` reader can decode and legacy v1 readers should reject instead of silently misdecoding. | expected_signals=Support: the run completes normally with export-only throughput still in-family with pgolf_0014; `Int8 auto-keep selector` still reports `candidates:19` and `selected:blocks.0.mlp.proj.weight`; `Int8 scale storage` still reports exactly `fp32_tensors:8` and `fp32_bytes:16384`; the new `Int8 row mean export` log reports exactly `tensors:8`, `values:4096`, `bytes:8192`, and `format:int8_row_mean_guarded_v2`; submission size rises only slightly versus pgolf_0014; and final exact round-trip metrics improve below val_bpb 1.58718007 and val_loss 2.67988706. Falsify: the selector changes unexpectedly, the fp32-scale audit changes, the row-mean audit does not show exactly `8 / 4096 / 8192 / int8_row_mean_guarded_v2`, the export still claims `int8_clean_per_row_v1` while using row means, or final exact metrics stay flat or worsen versus pgolf_0014. | pre_review_round=2 | post_review=Revert: pgolf_0022 appears trustworthy and the guarded row-mean export executed as intended, but it regressed versus the best prior kept result on the primary exact round-trip metric. final_int8_zlib_roundtrip_exact worsened from val_bpb 1.58718007 / val_loss 2.67988706 in pgolf_0014 to val_bpb 1.59204519 / val_loss 2.68810161 here, so this is not a clearly worthwhile retained change.
